,0
107,"6147056 | orotate | With due regard for impairments identified in the blood content of neurotransmitters, the patients received the multiple modality treatment, which included vitamins of group ""B"", potassium orotate, antihistamine drugs, the substitution of chloracon for phenobarbital and benzonal for diphenylhydantoin sodium; at the later stage of pregnancy the patients were given phenindamine tartrate."
108,"15808899 | beta-conglycinin | Previously, we found that orally administered soymetide-4 (MITL), an immunostimulating peptide derived from soybean beta-conglycinin alpha' subunit, suppressed alopecia induced by the anti-cancer drug etoposide in neonatal rats."
109,"10990540 | zn2+ | In contrast to the initial transient [Ca2+]i response, the sustained, receptor-activated increase in [Ca2+]i was rapidly abolished by chelation of extracellular Ca2+ or addition of Ni2+, Mn2+, Co2+ and Zn2+, but was unaffected by nifedipine, an antagonist of L-type voltage-activated Ca2+ channels."
110,"8103103 | beta-amyrin | Effects of beta-amyrin palmitate isolated from the leaves of Lobelia inflata were studied on the central nervous system of mice and were compared with those of antidepressant drugs, mianserin and imipramine."
111,"24829584 | anthocyanins | Nowadays attention to use herbs such as cornelian cherry (Cornus mas) is increasing, which contains high levels of antioxidants and anthocyanins."
112,"15964726 | matricaria recutita | The single peroral administration of the ethyl acetate extract or essential oil of German chamomile (Matricaria recutita L.) showed remarkable antipruritic effects in the compound 48/80-induced itch-scratching test in ddY mice, if suitable vehicle was used."
113,10353159 | glycyrrhizin | She was treated with topical application of corticosteroids twice a day and oral antihistamine once a day along with compound glycyrrhizin tablets 3 times a day.
114,"15799005 | capers | These two caper extracts displayed marked antiallergic effectiveness; however, the protective effect of CAP-H was very likely due to an indirect mechanism (for example, inhibition of mediator release from mast cells or production of arachidonic acid metabolites); conversely, CAP-C is endowed with direct antihistaminic properties."
115,"19657356 | sphingosine | An intradermal injection of SPC, but not sphingomyelin and sphingosine, induced scratching, an itch-associated response, which was not suppressed by a deficiency in mast cells or the H(1) histamine receptor antagonist terfenadine."
116,"38099 | nicotinate | The authors carried out studies on cats, guinea pigs, rats and mice, using isolated smooth muscle organs (bronchi, ileum of guinea pig), and examined bronchodilatating, diuretic, antihistaminic action and acute toxiticy of three N-basic substituted derivatives of 1,3-dimethiylxanthine (theophyline) namely: 7-bis-(2-hydroximethyl)-amino-ethyl theophyline under the form of a base (compound G111, tartarate (G112) and nicotinate (G113)."
117,"16193648 | mollusks | Intracellular dialysis and fixed membrane potential techniques were used to study the extracellular influence of antiarrhythmic drugs--brazidole (a new derivative of 2-mercaptobenzimidazole), amiodarone, sotalol, and hydroxyzine (a tranquilizer) in concentrations 1, 10, 100 and 1000 microM--on the slow potassium ionic transmembrane current in isolated neurons of Lymnnaea stagnalis mollusks."
118,27756601 | osthol | FXF is a third-generation antihistamine drug and osthole is assumed a natural antihistamine alternative.
119,27756601 | osthol | All results confirm our hypothesis that osthole is a natural histamine antagonist and therefore can be beneficially used in antihistamine treatment of conditions such as allergies.
120,26048308 | osthol | FXF is a third-generation antihistamine drug and osthole is assumed a natural antihistamine alternative.
121,"26048308 | osthol | Our study results confirm that FXF, osthole and histamine exert no cytotoxic effect on PBMCs and that IL-6, IL-10 and TNF- cytokine secretion following osthole cell stimulation was similar to that by FXF stimulation.This confirms our hypothesis that osthole is a natural histamine antagonist, and can therefore be beneficially applied in antihistamine treatment."
122,"14087615 | soy bean | Purified preparations of the esterase derived from the first component of complement (C'1 esterase) increased vascular permeability in guinea pig skin, an effect inhibited by triprolidine, an antihistaminic agent, but not by soy bean trypsin inhibitor."
123,1364164 | n-butanol | A flavonoid fraction (fraction B) obtained by partitioning the juice between n-butanol and water contained the substance responsible for the antihistamine activity.
