,0
0,"24251357 | silibinin | The present study was to investigate the effects of giving N-acetylcysteine (NAC) alone and in combination with either glycyrrhizin (GL), silibinin (SIB) or spironolactone (SL) on the plasma pharmacokinetic (PK) profiles, hepatic exposure, biliary excretion and urinary excretion of acetaminophen (APAP) and its major metabolite, acetaminophen glucuronide (AG)."
1,"8640239 | silibinin | The specific hepatoprotective action of silibinin against the toxicity of ethanol, phenylhydrazine and acetaminophen is also discussed."
2,8640239 | silibinin | It is suggested that the biochemical effects observed for the flavonoid in experimental models may settle the basis for understanding the pharmacological action of silymarin and silibinin.
3,"22285229 | mfa | Synergistic action of the MF and CLEA-Lac during operation achieved eliminations from aqueous solution of around 99%, nearly 100% and up to 85% for ACT, MFA and CBZ, respectively."
4,"24793595 | cinnamon | By means of NMR and LC/MS we found 863mg acetaminophen, 262mg sulfamethoxazole, 42mg indomethacin and less than 1% trimethoprim in a sachet of 2.617g powder content, in addition to some cinnamon bark and phosphate."
5,"28359199 | cymbopogon citratus | To investigate the hepatoprotective effect of Cymbopogon citratus or lemongrass essential oil (LGO), it was used in an animal model of acute liver injury induced by acetaminophen (APAP)."
6,"22011590 | tallow | We evaluated the effect of dietary corn oil (CO), olive oil (OO), and beef tallow (BT) on fatty acid composition of liver microsomal membrane and acute acetaminophen hepatotoxicity."
7,"25660481 | inosine | Canine hepatocytes were harvested and cell viability of clove-leaf oil (CLO), eugenol (EUG), lemongrass oil (LGO), guanosine monophosphate (GMP), inosine monophosphate (IMP), sorbose, ginger-root extract (GRE), cinnamon-bark oil (CBO), cinnamaldehyde (CINA), thymol oil (TO), thymol (THYM), and citric acid were assessed with positive controls: acetaminophen (APAP), aflatoxin B1 and xylitol."
8,"11031781 | allium | S-Allylmercaptocysteine (SAMC), one of the water-soluble organosulfur compounds in ethanol extracts of garlic (Allium sativum L.), has been shown to protect mice against acetaminophen (APAP)-induced liver injury."
9,"15916450 | allium | Allium sativum (garlic) decreased the area under the plasma concentration-time curve (AUC) and maximum plasma concentration of saquinavir, but not ritonavir and paracetamol (acetaminophen), in volunteers."
10,"11534764 | tyramine | Using p-nitrophenyl sulfate (PNS) as a donor substrate, alpha-naphthol was found to be the best acceptor substrate, followed by phenol, resorcinol, p-acetaminophen, tyramine and tyrosine."
11,"6939511 | tyramine | There was a significant correlation between the formation of MHPG sulfate by individual platelet preparations and the formation of sulfated product with each of the following substrates: tyramine (r = 0.92, n = 21); dopamine (r = 0.82, n = 16); 5-hydroxytryptamine (r = 0.94, n = 20); acetaminophen (r = 0.77, n = 17); and alphamethyldopa (r = 0.77, n = 17) (p less than 0.001 for each)."
12,"10600454 | tyramine | For PNS, alpha-naphthol is the best acceptor substrate, followed by phenol, resorcinol, p-acetaminophen, tyramine, and tyrosine."
13,"11379783 | tyramine | Using p-nitrophenyl sulfate (PNS) as a donor substrate, phenol is the best acceptor substrate, followed by alpha-naphthol, resorcinol, tyramine, acetaminophen, and tyrosine."
14,"15049342 | hydroxylamine | Cytotoxicity was assessed 24 hr after a 3 hr exposure to iodoacetamide, tert-butylhydrogenperoxide, menadione, or sulfamethoxazole hydroxylamine, or after a 2 hr exposure to N-acetyl-p-benzoquinoneimine, the reactive metabolite of acetaminophen."
15,"2983185 | hydroxylamine | The results indicate that for both p-hydroxyaniline and acetaminophen, a recently proposed peroxidase-like mechanism leading directly to p-benzoquinoneimines via radical intermediates is thermodynamically favored over N-hydroxylamine formation by H abstraction or addition rearrangement."
16,"23454338 | d-mannose | Excess saccharides including D-galactose, D-fructose, D-cellbiose, L-arabinose and D-sucrose, D-maltose, D-mannose and D-xylose as well as common interfering substances (acetaminophen, ascorbic acid and uric acid) did not affect the detection of D-glucose (0.1mM)."
17,"25119859 | procyanidin | In the present study, we investigated the role of almond (Prunus amygdalus) skin procyanidins (ASP) in regulating the protein expression of phase II detoxifying and antioxidant enzymes in HepG2 cells and acetaminophen (APAP)-treated hepatotoxic mice."
18,"24458977 | fennel | Together with previous findings, the presented in vitro data for CYP2E1 inhibition suggest that fennel and raspberry leaf have a significant potential of inhibiting all the major metabolic pathways for acetaminophen oxidation and NAPQI formation."
19,"21984979 | pulses | Here, we present electrochemical O-dealkylation of phenacetin to acetaminophen by square-wave potential pulses consisting of consecutive sub-second oxidation and reduction steps."
20,28006746 | anethole | The aim of this study is to investigate the effect of trans anethole on some inflammatory parameters that are involved in hepatotoxicity induced by high doses of acetaminophen.
21,"7476370 | anethole | Anethol dithiolthione (ADT), usually prescribed as a choleretic drug, when given orally 1 hour prior to acetaminophen (AAP) (450 mg/kg intraperitoneally) in Swiss female mice, exhibited an hepatoprotective potency at doses as low as 10 mg/kg relative to serum aminotransferase activities and hepatic glutathione related enzyme system (glutathione reductase, peroxidase, transferase)."
22,"1134883 | d-glucaric acid | Tweleve healthy 2- to 3-day-old full-term infants with plasma bilirubin concentrations of 1.0 to 11.6 mg/100 ml and D-glucaric acid excretion rates of 0.131 to 0.345 mg/kg/day received a single oral dose of acetaminophen, 12 mg/kg."
23,"1134883 | d-glucaric acid | Urine was collected serially for 48 hours and analyzed for acetaminophen, acetaminophen glucuronide, acetaminophen sulfate, and D-glucaric acid."
24,"26404304 | methylglyoxal | This feature article focuses on the recent design and use of carbon nanomaterials, primarily single-walled carbon nanotubes (SWCNTs), reduced graphene oxide (rGO), SWCNTs-rGO, Au nanoparticle-rGO nanocomposites, and buckypaper as sensing materials for the electrochemical detection of some representative biological and pharmaceutical compounds such as methylglyoxal, acetaminophen, valacyclovir, -nicotinamide adenine dinucleotide hydrate (NADH), and glucose."
25,"16797510 | liquorice | In addition, protective effects of GSH, liquorice extract and glycyrrhizic acid against acetaminophen hepatotoxicity were clearly observed in gel entrapped hepatocytes but not in hepatocyte monolayer at an incubation time of 48 h. Overall, gel entrapped hepatocytes showed higher sensitivities to acetaminophen-induced hepatotoxicity than hepatocyte monolayer by a mechanism that higher CYP 2E1 activities of gel entrapped hepatocytes could induce more severe acetaminophen toxicity."
26,"14757501 | alpha-lactose | The studied formulation was: acetaminophen 15%, alpha-lactose monohydrate 30%, cornstarch 45%, polyvinylpyrrolidone K30 5% and orange flavour 5% (w/w)."
27,"28031152 | sunflower | C57BL/6 male mice were divided into the following groups: control (C); sunflower oil (CO); acetaminophen 500mg/kg (APAP); acetaminophen 500mg/kg+lycopene 10mg/kg (APAP+L10), and acetaminophen 500mg/kg+lycopene 100mg/kg (APAP+L100)."
28,"23878731 | l-serine | Compounds including L-phenylalanine, L-serine, L-valine, urea, 4-acetaminophen, gallic acid and L-ascorbic acid were analyzed using both sources."
29,"25037050 | tocopherols | Conversely, cancer association was inverse with acetaminophen metabolites (OR <0.1), tocopherols (OR = 0.3), sitostanol (OR = 0.2), 3-dehydrocarnitine (OR = 0.4), pterin (OR = 0.3), conjugated-linoleate-18-2N7 (OR = 0.2), N-2-furoyl-glycine (OR = 0.3) and p-aminobenzoate (PABA, OR = 0.2)."
30,"2138998 | guanine | In order to cast light on carcinogen-specific molecular mechanisms underlying experimental hepatocarcinogenesis in rats, in vivo mutagenicity and mutation spectra of known genotoxic rat hepatocarcinogens N-nitrosopyrrolidine (NPYR), and 2-amino-3-methylimidazo[4,5-f]quinoline (IQ), as well as the nongenotoxic hepatocarcinogen di(2-ethylhexyl)phthalate (DEHP) and the noncarcinogen acetaminophen (AAP), were investigated in guanine phosphoribosyltransferase (gpt) delta transgenic rats, a recently developed animal model for genotoxicity analysis."
31,"19522529 | guanine | Different kinds of important inorganic and organic electroactive compounds (i.e., probe molecule (potassium ferricyanide), free bases of DNA (guanine (G), adenine (A), thymine (T), and cytosine (C)), oxidase/dehydrogenase-related molecules (hydrogen peroxide (H2O2)/beta-nicotinamide adenine dinucleotide (NADH)), neurotransmitters (dopamine (DA)), and other biological molecules (ascorbic acid (AA), uric acid (UA), and acetaminophen (APAP)) were employed to study their electrochemical responses at the CR-GO/GC electrode, which shows more favorable electron transfer kinetics than graphite modified glassy carbon (graphite/GC) and glassy carbon (GC) electrodes."
32,12814970 | genistein | The interaction studies showed that genistein inhibited formation of acetaminophen from phenacetin with an IC50 value of 16 microM.
33,23333575 | genistein | The purpose of this study was to investigate genistein's influence on the relationship between the activation of uridine diphosphate glucuronosyltransferase (UGTs) and the protection against acetaminophen-induced liver toxicity.
34,"27781231 | genistein | The results of the MTT, AST, ALT, LDH, GSH and GSSG assays showed that genistein evidently protected the cells from acetaminophen-induced injury in a dose-dependent manner."
35,"27781231 | genistein | The control cells were treated with 10 mM acetaminophen without genistein to compare with the effects of the combination of acetaminophen and genistein on the expression of UGT1A1, 1A6 and 1A9, Nrf2 and Keap1 mRNAs, as well as the expression of Nrf2 and Keap1 proteins, which were tested by western blotting."
36,"27781231 | genistein | Accordingly, the residual acetaminophen content was obviously reduced and acetaminophen glucuronidation increased after 24 hours of treatment with genistein in a dose-dependent manner."
37,"28240227 | genistein | In this report, selected non-steroidal anti-inflammatory drugs (NSAIDs), indomethacin and nimesulide, and analgesics acetaminophen, alone, as well as in combination with isoflavone genistein as potential glycosaminoglycan (GAG) metabolism modulators were considered for the treatment of mucopolysaccharidoses (MPSs) with neurological symptoms due to the effective blood-brain barrier (BBB) penetration properties of these compounds."
38,"28240227 | genistein | We found that indomethacin and nimesulide, but not acetaminophen, inhibited GAG synthesis in fibroblasts significantly, while the most pronounced impairment of glycosaminoglycan production was observed after exposure to the mixture of nimesulide and genistein."
39,28430162 | ginseng | The present study aimed to evaluate the potential hepatoprotective effects of black ginseng (BG) on APAP-induced mice liver injuries and the underlying mechanisms of action were further investigated for the first time.
40,25495794 | ginseng | This work aimed at evaluating the effect of fermented ginseng (FG) and fermented red ginseng (FRG) against rat liver injury caused by paracetamol (acetaminophen (APAP)).
41,"15916450 | ginseng | Previously, we found that Korean red ginseng suppressed acetaminophen (APAP)-induced hepatotoxicity via alteration of its metabolic profile involving GSTA2 induction and that ginsenoside Rg3 was a major component of this gene induction."
42,"10445408 | grapefruit | However, interaction between acetaminophen (also known as paracetamol in many parts of the world) and grapefruit juice has never been reported."
43,10445408 | grapefruit | The interaction of grapefruit juice with acetaminophen was examined in an in vivo mouse model.
44,"10445408 | grapefruit | BALB/c mice were fed 200 microL of white grapefruit juice or pink grapefruit juice by oral gavage (three mice in each group) followed by oral delivery of 10, 50, or 100 mg/kg acetaminophen 1 hour later."
45,10445408 | grapefruit | White grapefruit juice increased concentrations of acetaminophen in mice both 1 hour and 2 hours after feeding compared to controls.
46,"10445408 | grapefruit | In contrast, pink grapefruit juice increased acetaminophen concentrations 2 hours after feeding compared to controls."
47,10445408 | grapefruit | Because acetaminophen is almost completely absorbed these effects seems to be related to increased elimination half-life of acetaminophen because of interaction with grapefruit juice.
48,"9829623 | allium sativum | S-Allylmercaptocysteine (SAMC), one of the water-soluble organosulfur compounds in ethanol extracts of garlic (Allium sativum L.), has been shown to protect mice against acetaminophen (APAP)-induced liver injury."
49,"15916450 | allium sativum | Allium sativum (garlic) decreased the area under the plasma concentration-time curve (AUC) and maximum plasma concentration of saquinavir, but not ritonavir and paracetamol (acetaminophen), in volunteers."
50,"9795255 | phloretin | Intestinal glucuronidation and absorption of p-nitrophenol (p-NP), acetaminophen (APAP) and 1-naphthol (alpha-NA) in the presence of phloridzin (inhibitor of Na+/glucose cotransporter) and phloretin (aglycone of phloridzin) were studied."
51,"20657455 | gallic acid | Compounds including L-phenylalanine, L-serine, L-valine, urea, 4-acetaminophen, gallic acid and L-ascorbic acid were analyzed using both sources."
52,"19093450 | amoxycillin | In the present study, the possible drug interactions of andrographolide with co-administering drugs such as acetaminophen, amoxycillin, aspirin, chlorpheniramine and norfloxacin to treat various infectious and inflammatory diseases that may be induced during absorption process were examined using artificial lipophilic membrane and everted rat intestine."
53,"25663923 | amoxycillin | The patient was treated with morphine sulfate, metoclopramide, midazolam, diazepam, acetaminophen, ketamine, hyoscine butylbromide, propofol, dexamethasone and amoxycillin, and received parenteral nutrition."
54,"25660481 | cinnamaldehyde | Canine hepatocytes were harvested and cell viability of clove-leaf oil (CLO), eugenol (EUG), lemongrass oil (LGO), guanosine monophosphate (GMP), inosine monophosphate (IMP), sorbose, ginger-root extract (GRE), cinnamon-bark oil (CBO), cinnamaldehyde (CINA), thymol oil (TO), thymol (THYM), and citric acid were assessed with positive controls: acetaminophen (APAP), aflatoxin B1 and xylitol."
55,"2138998 | leukotriene b4 | We have studied discrete events in the process of signal transduction: NSAIDs but not a related analgesic drug (acetaminophen), inhibited aggregation in response to the chemoattractants f-Met-Leu-Phe (FMLP), leukotriene B4, and C5a."
56,"6307367 | leukotriene b4 | Leukotriene B4, glutathione disulfide, and the glutathione-S-conjugate of acetaminophen did not interfere with the transport of leukotriene C into hepatocytes."
57,19969075 | arjunolic acid | Arjunolic acid also prevented acetaminophen-induced hepatic glutathione depletion and APAP metabolite formation although arjunolic acid itself did not affect hepatic glutathione levels.
58,19969075 | arjunolic acid | The results suggest that this preventive action of arjunolic acid is due to the metabolic inhibition of specific forms of cytochrome P450 that activate acetaminophen to N-acetyl-p-benzoquinone imine.
59,"19969075 | arjunolic acid | In addition, administration of arjunolic acid 4 h after acetaminophen intoxication reduced acetaminophen-induced JNK and downstream Bcl-2 and Bcl-xL phosphorylation, thus protecting against mitochondrial permeabilization, loss of mitochondrial membrane potential, and cytochrome c release."
60,"19969075 | arjunolic acid | In conclusion, the data suggest that arjunolic acid affords protection against acetaminophen-induced hepatotoxicity through inhibition of P450-mediated APAP bioactivation and inhibition of JNK-mediated activation of mitochondrial permeabilization."
61,"25689681 | benzofuran | In addition to the expected activation of PPAR by fibrate drugs, di(2-ethylhexyl) phthalate, and perfluorinated compounds, PPAR was activated by benzofuran, galactosamine, and TCDD and suppressed by hepatotoxins acetaminophen, lipopolysaccharide, silicon dioxide nanoparticles, and trovafloxacin."
62,"8712683 | lipoamide | In common, both these proteins have a bis (cysteinyl) sequence motif cys-X-X-cys (for lipoamide dehydrogenase it is cys-X-X-X-X-cys) which is also an integral part of several other proteins such as thioredoxin, protein disulfide isomerase, endoplasmic reticulum protein (ERp72), selenoprotein W, 56kDa acetaminophen binding protein and formate dehydrogenase."
63,2069597 | barium | Lambs suckled a test solution consisting of acetaminophen and barium sulfate and 1 week later were tube fed the same test solution.
64,22560975 | crustaceans | Chronic toxicity of acetaminophen and lincomycin were evaluated using freshwater organisms including two crustaceans (Daphnia magna and Moina macrocopa) and a fish (Oryzias latipes).
65,"8125211 | uvaol | Uvaol significantly decreased CCl4- and Cd-induced hepatotoxicity, but had no effect on acetaminophen toxicity."
66,"890209 | unsaturated fatty acids | Acute injury to the liver frequently is due to the action of cytochrome P450, which breaks down drugs into electrophiles or free radicals; these reactive metabolites can covalently bind to protein and unsaturated fatty acids or induce lipid peroxidation, respectively."
67,"24788533 | caprolactam | Physical mixtures (PMs) and extruded formulations of PMOL with either polyvinyl caprolactam graft copolymer (Soluplus) or vinylpyrrolidone-vinyl acetate copolymer (Kollidon) in the solid state were characterized by using differential scanning calorimetry, hot-stage microscopy, and scanning electron microscopy."
68,"24280655 | cajanus cajan | The present work aims to evaluate the protective and ameliorative effects of two plant-derived proteins obtained from the seeds of Cajanus cajan and Caesalpinia gilliesii(Leguminosae) against the toxic effects of acetaminophen in kidney after chronic dose through determination of certain biochemical markers including total urea, creatinine, and kidney marker enzyme, that is, glyceraldehyde-3-phosphate dehydrogenase (GAPDH)."
69,"24414985 | cajanus cajan | This study aims to evaluate two proteins derived from the seeds of the plants Cajanus cajan (Leguminosae) and Caesalpinia gilliesii (Leguminosae) for their abilities to ameliorate the toxic effects of chronic doses of acetoaminphen (APAP) through the determination of certain biochemical parameters including liver marker enzymes: alanine aminotransferase, aspartate aminotransferase, alkaline phosphatase, and total bilirubin."
70,24816177 | oncorhynchus | The present study aimed to assess the toxic effects of acetaminophen (APAP) in Oncorhynchus mykiss following acute and chronic exposures in realistic levels.
71,"11351354 | punicalagin | In this study, the antihepatotoxic activity of punicalagin and punicalin on acetaminophen-induced toxicity in the rat liver was evaluated."
72,"11351354 | punicalagin | After evaluating the changes of several biochemical functions in serum, the levels of aspartate aminotransferase (AST) and alanine aminotransferase (ALT) were increased by acetaminophen administration and reduced by punicalagin and punicalin."
73,12893300 | l-proline | A kinetic study of acetaminophen oxidation by tyrosinase in the presence of a physiological nucleophilic agent such as the amino acid L-proline is performed in the present paper.
74,"15062871 | tungsten | The progression of liver injury produced by the compounds causing oxidative stress without initiating the generation of free radicals such as bromobenzene (BB), or acetaminophen (AAP), could not be inhibited by tungsten."
75,15754502 | vigna angularis | We examined the hepatoprotective effect of water-extract from adzuki bean (Vigna angularis) hulls on acetaminophen (AAP)-induced damage in rat liver.
76,"11791733 | ajoene | Ajoene, a garlic-derived sulfur-containing compound, exhibited a hepatoprotective effect against acetaminophen-induced liver injury in mice."
77,11791733 | ajoene | The pretreatment by ajoene also suppressed the decrease in hepatic protein thiol content resulting from acetaminophen administration.
78,"3544930 | acetol | As direct evidence that P-450ALC catalyzes numerous metabolic reactions, the purified rabbit enzyme has been used in a reconstituted system to demonstrate various metabolic transformations, including the oxidation of various alcohols, acetone, acetol, p-nitrophenol, and aniline, the dealkylation of substituted nitrosamines, the reductive dechlorination of carbon tetrachloride, carbon tetrachloride-induced lipid peroxidation, and acetaminophen activation to form the glutathione conjugate."
79,"3825173 | haem | In the case of cytochrome P-450b, the acetylamino group of paracetamol most closely approached the haem iron ion."
80,"2219115 | (-)-borneol | The in vitro activity of UGTs was evaluated using different substrates such as estradiol (UGT1A1), acetaminophen (UGT1A6/7), morphine (UGT2B1), testosterone (UGT2B1/3/6), androsterone (UGT2B2), and (-)-borneol (UGT2B12)."
81,"8878354 | phenylacetate | Chemical biopsy of glucuronic acid by acetaminophen also permits the study of glycogen synthesis whereas chemical biopsies of liver glutamine by phenylacetate and of cytosolic acetyl-CoA by sulfamethoxazole give important information concerning, respectively, Krebs cycle activity and glconeogenesis and on lipogenesis and cholesterol synthesis."
82,"7989593 | phenylacetate | To determine the effect of insulin-dependent diabetes mellitus (IDDM) on rates and pathways of hepatic glycogen synthesis, as well as flux through hepatic pyruvate dehydrogenase, we used 13C-nuclear magnetic resonance spectroscopy to monitor the peak intensity of the C1 resonance of the glucosyl units of hepatic glycogen, in combination with acetaminophen to sample the hepatic UDP-glucose pool and phenylacetate to sample the hepatic glutamine pool, during a hyperglycemic-hyperinsulinemic clamp using [1-13C]-glucose."
83,"9815005 | phenylacetate | Anaplerotic, pyruvate recycling, and gluconeogenic fluxes were measured by 13C isotopomer analysis of plasma glucose, urinary phenylacetylglutamine, and urinary glucuronide in normal, 24-h-fasted individuals after ingestion of [U-13C]propionate, phenylacetate, and acetaminophen."
84,"1865562 | phenylacetate | Thus, glucuronide formation has been used to sample hepatic uridine diphosphate glucose (UDP-glucose) and study glycogen metabolism and the pentose pathway, phenylacetate to sample hepatic alpha-ketoglutarate and estimate relative flux through the Krebs cycle, and acetylation to sample hepatic acetyl CoA."
85,"3356406 | polyamines | Polyamines and acetylpolyamines were analyzed in the liver, spleen, lung, kidney, serum and urine by high-performance liquid chromatography on a column of cation-exchange resin after administering various cytotoxic substances to male mice."
86,"3356406 | polyamines | All of the compounds tested more or less affected the tissue levels of polyamines, including putrescine, spermidine, spermine and acetylpolyamines (N1-acetylspermidine and N1-acetylspermine)."
87,"16359826 | polyamines | In vitro, transglycation occurs readily with amino acids, polyamines, thiols and thiolamines."
88,"22433041 | asparagus | In this study, the effect of Asparagus falcatus extract on acetaminophen-induced liver injury was investigated in vivo."
89,"20354348 | nobiletin | Nobiletin, the most important compound in the n-hexane-soluble fraction, also had suppressive effects on liver injuries induced by carbon tetrachloride, acetaminophen and GalN/lipopolysaccharide (LPS) in addition to liver injury induced GalN."
90,"11330834 | proanthocyanidins | Specifically, some of our earlier studies have shown that IH636 grape seed proanthocyanidin extract (GSPE, commercially known as ActiVin) provides excellent concentration- and dose-dependent protection against toxicities induced by diverse agents, such as acetaminophen, hydrogen peroxide, 12-O-tetradecanoylphorbol-13-acetate (TPA), smokeless-tobacco extract, idarubicin and 4-hydroxyperoxycyclophosphamide in both in vitro and in vivo models."
91,"11334361 | proanthocyanidins | This study assessed the ability of IH636 grape seed proanthocyanidin extract (GSPE) to prevent acetaminophen (AAP)-induced nephrotoxicity, amiodarone (AMI)-induced lung toxicity, and doxorubicin (DOX)-induced cardiotoxicity in mice."
92,"26175014 | selenite | Of the chemicals examined, 13-cis-retinoic acid, ethanol, ibuprofen, lead acetate, salicylic acid, and selenate inhibited the migration of cNCCs at their embryotoxic concentrations; no effects were observed for acetaminophen, caffeine, indium, phenytoin, selenite, tributyltin, and valproic acid."
93,"2901147 | selenite | Pretreatment of male, Sprague-Dawley rats with sodium selenite (12.5 mumol Se/kg, ip) 24 hr prior to acetaminophen administration produced a significant protection against the hepatotoxic effects of acetaminophen as assessed by a decrease in the plasma appearance of alanine aminotransferase and aspartate aminotransferase activities following acetaminophen."
