,0
94,9687086 | kaurenoic acid | It was found that such fractions as well as kaurenoic acid and luteolin exhibit marked antinociceptive action in mice using acetic acid-induced writhing.
95,"8619244 | molybdate | However, we recently reported that molybdate decreases the sulfation of acetaminophen in rat liver."
96,"8033252 | molybdate | Administration of molybdate, which is an alternative substrate for intestinal and renal sulfate transport as well as for ATP-sulfurylase, depleted both sulfate and PAPS in liver and markedly inhibited sulfation of acetaminophen."
97,"7932164 | molybdate | The effect of molybdate on the pharmacokinetics of acetaminophen (AA, 150 mg/kg i.v.)"
98,"15486947 | 2-amino-3-methylimidazo[4,5-f]quinoline | In order to cast light on carcinogen-specific molecular mechanisms underlying experimental hepatocarcinogenesis in rats, in vivo mutagenicity and mutation spectra of known genotoxic rat hepatocarcinogens N-nitrosopyrrolidine (NPYR), and 2-amino-3-methylimidazo[4,5-f]quinoline (IQ), as well as the nongenotoxic hepatocarcinogen di(2-ethylhexyl)phthalate (DEHP) and the noncarcinogen acetaminophen (AAP), were investigated in guanine phosphoribosyltransferase (gpt) delta transgenic rats, a recently developed animal model for genotoxicity analysis."
99,"23723564 | safrole | The genotoxic carcinogens 2-acetylaminofluorene (2-AAF), 2-amino-3-methylimidazo [4,5-f] quinolone (IQ) and safrole (SF), the non-genotoxic carcinogens piperonyl butoxide (PBO) and phenytoin (PHE), the non-carcinogen acetaminophen (APAP) and the genotoxic non-hepatocarcinogen aristolochic acid (AA) were tested to validate the GPG46 model."
100,"14738926 | 4'-hydroxyacetophenone | A high-performance liquid chromatography (HPLC) method has been developed and validated for the simultaneous determination of n-propionyl-p-aminophenol, 3-chloro-4-hydroxyacetanilide, 4'-hydroxyacetophenone, 4-hydroxyacetophenone oxime, 4-acetoxyacetanilide and 4'-chloroacetanilide, the main impurities in acetaminophen drug substance."
101,"25519295 | acetoacetate | The interferences assessed included acetoacetate, acetaminophen, ascorbic acid, galactose, maltose, uric acid, and sodium."
102,"28112939 | methylparaben | Molecular dynamics simulations were employed to both estimate the solubility of nonelectrolyte solids, such as acetanilide, acetaminophen, phenacetin, methylparaben, and lidocaine, in supercritical carbon dioxide and understand the underlying molecular-level driving forces."
103,"28300022 | methylparaben | The method provided a precise estimation of PPCPs in field samples, and acetaminophen, atenolol, metformin, sulfamethoxazole, carbamazepine, methylparaben, and triclosan were detected in concentrations ranging from 0.10 to 1.40 and 0.10 to 3.4 ng/mL in surface water and sewage water, respectively."
104,"26175014 | selenate | Of the chemicals examined, 13-cis-retinoic acid, ethanol, ibuprofen, lead acetate, salicylic acid, and selenate inhibited the migration of cNCCs at their embryotoxic concentrations; no effects were observed for acetaminophen, caffeine, indium, phenytoin, selenite, tributyltin, and valproic acid."
105,"19609937 | l-glutamate | We assessed the sensitivity of HUCB-NSCs at different developmental stages to a panel of neurotoxic (sodium tellurite, methylmercury chloride, cadmium chloride, chlorpyrifos, and L-glutamate) and non-neurotoxic (acetaminophen, theophylline, and D-glutamate) compounds."
106,22781444 | moringa oleifera | The present study was to investigate the therapeutic effects of the hydroethanolic extract of Moringa oleifera (MO) leaves and flowers against hepatotoxicity induced by acetaminophen (APAP) in rats.
107,"28066249 | 4-hydroxyphenylacetic acid | For evaluation of the expression of CYP2E1 in different herbal treatment samples, the mice were treated by oral gavage for 3 days with alcohol (50% 15 mL/kg), acetaminophen (APAP, 300 mg/kg), Cornus officinalis extract (100 mg/kg), Alhagi-honey extract (100 mg/kg), Apocynum venetum extract (100 mg/kg), hyperoside (50 mg/kg), isoquercetin (50 mg/kg), 4-hydroxyphenylacetic acid (50 mg/kg), 3-hydroxyphenylacetic acid (50 mg/kg), and 3,4-hydroxyphenylacetic acid (50 mg/kg)."
108,"26857812 | maltodextrin | The inclusion of the thickener, comprised of xanthan gum and maltodextrin, had a considerable impact on dissolution; acetaminophen release from modified medications reached 12-50% in 30min, which did not reflect the pharmacopeia specification for immediate release preparations."
109,"17964129 | maltodextrin | Powder mixtures containing acetaminophen, mannitol, erythritol, maltodextrin, crospovidone, colloidal silicon dioxide and polyoxyethylene 20 sorbitan monooleate were prepared via co-spray drying."
110,"18363140 | maltodextrin | Four-component mixtures containing acetaminophen, mannitol, erythritol, and maltodextrin were produced by cospray drying."
111,"17576058 | maltodextrin | Powder mixtures containing acetaminophen, mannitol, erythritol and different maltodextrin types were prepared via co-spray drying and physically mixed with crospovidone (6% w/w, Kollidon CL) in order to evaluate the influence of maltodextrin grade (amylose/amylopectin ratio) on powder hygroscopicity, flowability, density and compactability."
112,"17317123 | maltodextrin | Erythritol, lactose, maltodextrin, and mannitol were efficient in co-spray drying with acetaminophen."
113,"9121721 | gentisic acid | There were no reductions of the amyloid beta protein activations by acetylsalicylic acid (ASA), gentisic acid, sulindac sulfone and acetaminophen."
114,"1334228 | gentisic acid | Mechanisms of proton transport were investigated in planar phospholipid bilayer membranes exposed to aspirin (acetylsalicylic acid), acetaminophen (4-acetamidophenol), benzoic acid and three aspirin metabolites (salicylic acid, gentisic acid and salicyluric acid)."
115,"4061463 | gentisic acid | The in vitro effects of ascorbic acid, acetaminophen, salicylic acid, and gentisic acid on home blood-glucose-measurement systems were studied."
116,"21644253 | gentisic acid | A simple and sensitive method has been developed for the simultaneous determination of polar nonsteroidal pharmaceuticals and metabolites, including acetaminophen, p-aminophenol and several aspirin metabolites (salicylic acid, gentisic acid, salicyluric acid and 2,3-dihydroxybenzoic acid), by capillary liquid chromatography with amperometric detection."
117,27058600 | a. cepa | The objective of this study was to evaluate the action of Hymenaea stigonocarpa bark hydroalcoholic extract against a mutagenic compound using A. cepa meristematic root cells as a test system.
118,"27058600 | a. cepa | Furthermore, the three ST concentrations significantly reduced the number of cell aberrations when compared to the number of aberrant cells obtained for the PC, demonstrating antimutagenic action on the A. cepa test system cells."
119,"17132218 | rubus | This study investigated the mutagenic, anti-mutagenic and cytotoxic effects of acetone extract of raspberry, Rubus idaeus L. (v. Ottawa) Rosaceae, and the isolated and characterized ellagitannin and anthocyanin fractions thereof, suitable for food applications."
120,"25119859 | almond | In the present study, we investigated the role of almond (Prunus amygdalus) skin procyanidins (ASP) in regulating the protein expression of phase II detoxifying and antioxidant enzymes in HepG2 cells and acetaminophen (APAP)-treated hepatotoxic mice."
121,"24251357 | glycyrrhizin | The present study was to investigate the effects of giving N-acetylcysteine (NAC) alone and in combination with either glycyrrhizin (GL), silibinin (SIB) or spironolactone (SL) on the plasma pharmacokinetic (PK) profiles, hepatic exposure, biliary excretion and urinary excretion of acetaminophen (APAP) and its major metabolite, acetaminophen glucuronide (AG)."
122,"22821628 | glycyrrhizin | Meanwhile, serum high-mobility group box 1 (HMGB1), a damage-associated molecule released from necrotic hepatocytes, increased after acetaminophen challenge, and the HMGB1 inhibitor glycyrrhizin markedly reduced the production of IL-23 and IL-17A and the recruitment of hepatic neutrophils."
123,25032255 | glycyrrhizin | The present study aimed to give a short report on a possible mechanism of glycyrrhizin to acetaminophen-induced liver toxicity.
124,"25032255 | glycyrrhizin | Seven-day intraperitoneal administration of glycyrrhizin (400 mg/kg/day) to 2- to 3-month-old male C57BL/6N mice (mean weight 27 g) significantly prevents acetaminophen-induced liver damage, as indicated by the activity of alanine transaminase and aspartate aminotransferase."
125,25032255 | glycyrrhizin | The treatment of glycyrrhizin significantly reversed the increased levels of long-chain acylcarnitines induced by acetaminophen administration.
126,"25032255 | glycyrrhizin | In conclusion, this metabolomic study indicates a significant glycyrrhizin protection effect against acetaminophen-induced liver damage through reversing fatty acid metabolism."
127,"16216454 | isorhamnetin | In this study, the effect of the flavonoids quercetin-3-methyl-ether (isorhamnetin) (1), quercetin-3,7-dimethyl-ether (2) and kaempferol-3,7-dimethyl-ether (3) isolated from Cistus laurifolius L. (cistaceae) leaves was assessed on lipid peroxidation (liver and plasma), cellular glutathione (GSH) level and plasma AST (aspartate aminotransferase), ALT (alanine aminotransferase) enzyme activities in acetaminophen-induced liver damage in mice."
128,"17045319 | isorhamnetin | This occurred as a result of CYP3A induction by ginkgolide A because triacetyloleandomycin (TAO), a specific inhibitor of CYP3A catalytic activity, completely blocked the effect of ginkgolide A. Ginkgolide B, ginkgolide C, ginkgolide J, quercetin, kaempferol, isorhamnetin, and isorhamnetin-3-O-rutinoside did not alter the extent of LDH leakage by acetaminophen."
129,25447604 | thymoquinone | We aimed to investigate efficacy of intraperitoneally administered Thymoquinone (TQ) in acetaminophen (APAP) induced renal toxicity.
130,17045319 | ginkgo biloba | The present cell culture study investigated the effect of Ginkgo biloba extract pretreatment on acetaminophen toxicity and assessed the role of ginkgolide A and cytochrome P450 3A (CYP3A) in hepatocytes isolated from adult male Long-Evans rats provided ad libitum with a standard diet.
131,"10809284 | phytomenadione | To investigate the effects of the association of inhaled nitric oxide (iNO) and oxidant drugs (acetaminophen, phytomenadione, and EMLA cream) on methemoglobinemia during the neonatal period."
132,10190184 | corylus avellana | Our study investigated the effects of Corylus avellana extract on acetaminophen and carbon tetrachloride intoxicated liver of young rats.
133,27207064 | yttrium | An electrochemical sensor was prepared by modifying a glassy carbon electrode (GCE) with a composite of yttrium (III) oxide nanoparticles (Y2O3NPs) and carbon nanotubes (CNTs) for the determination of acetaminophen (ACT).
134,"15319808 | yttrium | This issue focuses on the following selection of drugs: 166Ho-DOTMP 5A8; A-179578, abetimus sodium, adefovir dipivoxil, AGI-1067, AIDSVAX gp120 B/B, AK-602, alefacept alemtuzumab, aliskiren fumarate, ALVAC vCP1433, ALVAC vCP1452, anecortave acetate, arzoxifene hydrochloride, atazanavir sulfate, atlizumab, avasimibe; Binodenoson, BMS-488043; Choriogonadotropin alfa, ciclesonide, COL-1621, CVT-3146, CVT-E002, Cypher; Daptomycin, darbepoetin alfa, darunavir, D-D4FC, deferasirox, desloratadine, desmoteplase, duloxetine hydrochloride, DX-9065a; E-5564, efalizumab, emfilermin, emivirine, emtricitabine, enfuvirtide, estradiol acetate, ezetimibe; Frovatriptan; Gallium maltolate, gefitinib; HIV-1 Immunogen, human insulin; Iguratimod, IL-4/IL-13 Trap, imatinib mesylate, inhaled insulin, insulin glargine, irofulven, ISS-1018, ivabradine hydrochloride; Lutropin alfa; Melatonin; Nesiritide; O6-Benzylguanine, omapatrilat, oritavancin, ospemifene; Parecoxib sodium, peginterferon alfa-2a, pexelizumab, pimecrolimus, pirfenidone, pramlintide acetate, prasterone sulfate PT-141; Rasburicase, razaxaban hydrochloride, recombinant malaria vaccine, rhBMP-2/ACS, roflumilast, rosiglitazone maleate/metformin hydrochloride, rotavirus vaccine; SCH-D, sitaxsentan sodium, solifenacin succinate; Targinine hydrochloride, taxus, TER-199, tramadol hydrochloride/acetaminophen; Valdecoxib, valganciclovir hydrochloride, vatalanib succinate, VEG Trap(R1R2); Ximelagatran; Yttrium Y90 Epratuzumab."
135,"15319815 | yttrium | This issue focuses on the following selection of drugs: 101M; Adalimumab, adefovir dipivoxil, adenosine triphosphate, albumin interferon alfa, alefacept, alemtuzumab, aminolevulinic acid hexyl ester, autologous renal tumor vaccine, azimilide hydrochloride; Bortezomib, bosentan, BR-1; C340, cantuzumab mertansine, caspofungin acetate, CGP-36742, CHAMPION everolimus-eluting coronary stent, cypher; Dalbavancin, darbepoetin alfa, desloratadine, duloxetine hydrochloride, dutasteride; Efalizumab, emtricitabine, enfuvirtide, erlosamide, ertapenem sodium, everolimus, ezetimibe; Flesinoxan hydrochloride, fosamprenavir calcium, FR-901228, frovatriptan; Gadofosveset sodium, gadomer-17, galiximab, gamma-hydroxybutyrate sodium, gefitinib; HuOKT3gamma1(Ala234-Ala235); IDN-6556, imatinib mesylate, iodine (I131) tositumomab, iseganan hydrochloride, ixabepilone; Keratinocyte growth factor; LB-80380, levocetirizine, liposomal doxorubicin, LMB-9, lopinavir, lopinavir/ritonavir, lumiracoxib, lurtotecan; Mecasermin, midostaurin, morphine hydrochloride; Natalizumab, nelfinavir, nesiritide, niacin/lovastatin; Olcegepant, omalizumab, oregovomab; Parecoxib sodium, PEG-filgrastim, peginterferon alfa-2a, peginterferon alfa-2b, peginterferon alfa-2b/ ribavirin, perospirone hydrochloride, pexelizumab, pimecrolimus, prinomastat; Resiquimod, rhIGFBP-3, rhIGF-I/rhIGFBP-3, ritanserin, ro-31-7453, rosuvastatin calcium; SCIO-469, SDZ-SID-791, SU-11248, suberanilohydroxamic acid; Tadalafil, taxus, telithromycin, tenofovir disoproxil fumarate, TER-286, tezosentan disodium, TH-9507, tipifarnib, tipranavir, tolvaptan, tramadol hydrochloride/acetaminophen, travoprost, treprostinil sodium, tucaresol; Valganciclovir hydrochloride, val-mCyd, vardenafil hydrochloride hydrate, vinflunine, voriconazole; Ximelagatran, XTL-002; Yttrium 90 (90Y) ibritumomab tiuxetan."
136,"25770447 | cholestanol | In this study, 13 wastewater chemicals (chloride, boron, orthosphophate, detergents as methylene blue active substances, cholesterol, cholestanol, coprostanol, diethylhexyl phthalate, caffeine, acetaminophen, ibuprofen, sucralose and saccharin) were investigated in order to evaluate tracers for human faecal and sewage contamination in tropical urban catchments."
137,"19446955 | wheat | In order to assess ecological risk of pharmaceutical compounds entering into agricultural ecosystems, toxic effects of paracetamol with therapeutic action on wheat (Triticum aestivum L.) were investigated as an example, using early growing and developmental indexes of wheat, including seed germination, shoot height and root length, peroxidase, superoxide dismutase, chlorophyll, and soluble protein in the seedlings."
138,"17484515 | valerenic acid | Valerenic acid also demonstrated significant inhibitory effects on the glucuronidation of acetaminophen, oestradiol, and morphine with both microsomes and expressed UGTs."
139,"21305852 | syringic acid | The protective effect of the phenolic compound syringic acid, one of the major benzoic acid derivatives from edible plants and fruits, was evaluated against acetaminophen (APAP)-induced hepatotoxicity in rats."
140,14629735 | ice cream | The effect of added food mixture (as if food was present in the stomach of an intoxicated patient) or 4 different types of ice cream (added as a flavouring and lubricating agent) on the adsorption of paracetamol (acetaminophen) to 2 formulations of activated charcoal was determined in vitro and compared with results from previous investigations showing a maximum adsorption capacity to the two activated charcoal-water slurries at about 0.62-0.72 g paracetamol/g activated charcoal.
141,28194962 | carbamate | A targeted reversed-phase gradient UPLC-MS/MS assay has been developed for the quantification /monitoring of 66 amino acids and amino-containing compounds in human plasma and serum using precolumn derivatization with 6-aminoquinolyl-N-hydroxysuccinimidyl carbamate (AccQTag Ultra).
142,"15724487 | carbamate | The selected substances included methanol, barbital drugs, benzodiazepines, tricyclic or tetracyclic antidepressants, methamphetamine, acetaminophen, salicylic acid, bromovalerylurea, organophosphorus pesticides, carbamate pesticides, paraquat, glufosinate, cyanides, arsenic, and theophylline."
143,"10444831 | carbamate | The procedures were successfully applied to the determination of phenolic drugs (epinephrine, acetaminophen, and gualacol) in pharmaceuticals and carbamates (bendiocarb, benfuracarb, carbaryl, carbofuran, methiocarb, promecarb, and propoxur) in pesticide products and water samples."
144,"8125211 | ursolic acid | In conclusion, among the 10 triterpenoid compounds examined, alpha-hederin, ursolic acid, and oleanolic acid appear to be the most effective in protecting against CCl4-, acetaminophen-, and Cd-induced liver injury."
145,"26067340 | hippuric acid | Four model samples, acetaminophen, metronidazole, quinine, and hippuric acid, dissolved in three kinds of common buffers were used in the SPR-DART-MS experiments for performance evaluation of the interface and the optimization of DART conditions."
146,6269779 | hippuric acid | Hippuric acid is separated and quantitated on a reversed-phase column under conditions similar to those used for assay of theophylline and acetaminophen.
147,"15983950 | hippuric acid | Methanol, ethylene glycol, acetone, ethanol, d -lactate, and hippuric acid screens were negative."
148,"18472313 | trigonelline | ferulic acid), trigonelline, S-adenosyl-L-methionine, and energy-related metabolites indicated that oxidative stress was caused by acute and chronic acetaminophen administration."
149,"24325902 | domoic acid | Spontaneous firing rate in primary cortical cultures was increased by bicuculline (BIC), lindane (LND), RDX and picrotoxin (PTX); not changed by nicotine (NIC), acetaminophen (ACE), and glyphosate (GLY); and decreased by muscimol (MUS), verapamil (VER), fipronil (FIP), fluoxetine (FLU), chlorpyrifos oxon (CPO), domoic acid (DA), deltamethrin (DELT) and dimethyl phthalate (DMP)."
150,"27492221 | domoic acid | Rat (0-24 h old) primary cortical cells were plated in 48 well-MEA plates and exposed to 6 compounds: acetaminophen, bisindolylmaleimide-1 (Bis-1), domoic acid, mevastatin, sodium orthovanadate, and loperamide for a period of 12 days."
151,"24148773 | 3,5-di-o-caffeoylquinic acid | The ethyl acetate (EA) fraction of G. koraiensis and its major compound, 3,5-di-O-caffeoylquinic acid (DCQA), exerted protective effects in the t-BHP-induced liver cytotoxicity model."
152,"20020764 | l-leucine | The initial performance of the microplasma device has been evaluated by ionizing samples containing dimethyl sulfoxide (DMSO), dimethylformamide (DMF), methyl salicylate, caffeine, l-leucine, l-histidine, loratadine, ibuprofen, acetaminophen, acetylsalicylic acid, and cocaine in various forms."
153,17045319 | ginkgolide c | The present cell culture study investigated the effect of Ginkgo biloba extract pretreatment on acetaminophen toxicity and assessed the role of ginkgolide A and cytochrome P450 3A (CYP3A) in hepatocytes isolated from adult male Long-Evans rats provided ad libitum with a standard diet.
154,"17045319 | ginkgolide c | At the level present in a modulating concentration (50 mug/ml) of the extract, ginkgolide A (0.55 mug/ml), which increased CYP3A23 mRNA levels and CYP3A-mediated enzyme activity, accounted for part but not all of the potentiating effect of the extract on acetaminophen toxicity."
155,"17045319 | ginkgolide c | This occurred as a result of CYP3A induction by ginkgolide A because triacetyloleandomycin (TAO), a specific inhibitor of CYP3A catalytic activity, completely blocked the effect of ginkgolide A. Ginkgolide B, ginkgolide C, ginkgolide J, quercetin, kaempferol, isorhamnetin, and isorhamnetin-3-O-rutinoside did not alter the extent of LDH leakage by acetaminophen."
156,"17045319 | ginkgolide c | In summary, G. biloba pretreatment potentiated acetaminophen toxicity in cultured rat hepatocytes and ginkgolide A contributed to this novel effect of the extract by inducing CYP3A."
157,"8742516 | nicotinic acid | While the PARP-activity remained essentially unchanged, the acetaminophen-induced release of both GOT and GPT from injured liver cells could be inhibited by 90-99%, when mice were injected additionally with the selective PARP-inhibitors nicotinic acid amide, benzamide, caffeine, theophyline, and thymidine, respectively."
158,"8742498 | nicotinic acid | Recently, we demonstrated the hepatoprotective effects of nicotinic acid amide, a selective inhibitor of poly(ADP-ribose) polymerase (PARP; EC 2.4.2.30) on mice suffering from acetaminophen (AAP)-hepatitis, suggesting that the AAP-induced liver injury involves a step which depends on adenoribosylation."
159,18462991 | nicotinic acid | Four aromatic medicines (acetaminophen; niacinamide; p-aminophenol; nicotinic acid) containing nitrogen were investigated by FT-NIR (Fourier transform near-infrared) spectroscopy and generalized two-dimensional (2D) correlation spectroscopy.
160,"19634356 | nicotinic acid | A steel surface was soiled with solutions of acetaminophen, nicotinic acid, diclofenac, and benzamidine and wiped with each swabbing material."
161,"3171878 | nicotinic acid | trimetoquinol, TA-594, acetaminophen, naproxen and nicotinic acid, were synthesized and administered orally to rats cannulated in the thoracic duct."
162,6083701 | beta-phenethyl alcohol | Acetaminophen-induced hepatotoxicity was not accentuated by beta-phenethyl alcohol or ethanol pretreatment.
163,"2356011 | s-carboxymethyl-l-cysteine | Patients with AD, compared with controls, have reduced sulfoxidation of the probe drug S-carboxymethyl-L-cysteine; they also form less of the sulfate conjugate of acetaminophen."
164,27668721 | barley | The present work aimed to assess the ecotoxicological relevance of acetaminophen (AC) and nickel oxide nanomaterial (nano-NiO) to barley plants.
165,18022931 | yogurt | The acetaminophen group received 200 mg/kg/day of acetaminophen suspended in yogurt via oral gavage for 120 days.
166,"12834962 | pantothenic acid | The drugs evaluated were analgesics (acetaminophen, aspirin, codeine, methadone, morphine and pethidine), antibiotics (amoxicillin, ampicillin, gentamicin, neomycin, penicillin G and vancomycin), antipsychotics (chlorpromazine, fluphenazine, prochlorperazine, promazine and thioridazine) and water-soluble vitamins (ascorbic acid, niacinamide, pantothenic acid and pyridoxine)."
167,21239480 | sesamol | We investigated the anti-hepatotoxic effects of sesamol and N-acetylcysteine on acetaminophen-induced hepatotoxicity in mice.
168,21239480 | sesamol | Equimolar doses (1 mmol/kg) of sesamol and N-acetylcysteine significantly inhibited acetaminophen (300 mg/kg)-increased serum aspartate transaminase and alanine transaminase levels 6 h post-administration.
169,"21239480 | sesamol | Moreover, the combination of sesamol and N-acetylcysteine antagonistically inhibited sesamol's protection against acetaminophen-induced liver injury."
170,21239480 | sesamol | We conclude that the protective effect of sesamol against acetaminophen-induced liver damage is comparable to that of N-acetylcysteine by maintaining glutathione levels and inhibiting lipid peroxidation in mice.
171,27427136 | pomegranate | To observe the ameliorating effect by methanolic extract of pomegranate peel in acetaminophen-induced hepatotoxicity.
172,"23414233 | d-mannitol | Spherical agglomerates of lactose were shown to enhance the nucleation rate of acetaminophen (AAP) by a factor of 11 compared to single crystal lactose; however, no such enhancement was observed for D-mannitol."
173,"10999435 | arctium lappa | Rats were divided into 4 groups: normal control group, Arctium lappa extract group, acetaminophen-injected group, and acetaminophen treated with Arctium lappa extract group."
174,25350500 | arctium lappa | To investigate the ameliorative effects of Arctium lappa root extract on acetaminophen-induced hepatotoxicity.
175,27069723 | c. papaya | This study investigated the hepatomodulatory effects of aqueous extracts of C. papaya leaf (CPL) and unripe fruit (CPF) at doses of 100 and 300 mg/kg on carbon tetrachloride (CCl4) and acetaminophen (ACM)-induced liver toxicities in rats.
176,"20734624 | linum usitatissimum | Phytoremediation of selected pharmaceuticals (diclofenac, ibuprofen, and acetaminophen) using Armoracia rusticana and Linum usitatissimum cell cultures and by hydroponically cultivated Lupinus albus, Hordeum vulgaris, and Phragmites australis plants in laboratory conditions is described."
177,"19446955 | triticum aestivum | In order to assess ecological risk of pharmaceutical compounds entering into agricultural ecosystems, toxic effects of paracetamol with therapeutic action on wheat (Triticum aestivum L.) were investigated as an example, using early growing and developmental indexes of wheat, including seed germination, shoot height and root length, peroxidase, superoxide dismutase, chlorophyll, and soluble protein in the seedlings."
