,0
178,"20052997 | mn2+ | The data generated in the current work provide the basic information on the effect of bivalent cations, namely, Ca2+, Zn2+ and Mn2+, on the HPMMs' solubility and, consequently, on the performances (disintegration and drug dissolution) of acetaminophen gastroresistant tablets when exposed to fluid containing such salts."
179,"8216352 | lignan | The preventive effect of gomisin A, a lignan component of shizandra fruits, on acetaminophen-induced hepatotoxicity in rats was examined by histological and biochemical analysis."
180,11724372 | lignan | A methanolic extract and two fractions (n-hexane and ethyl acetate) from Virola oleifera leaves and some compounds (one lignan and two flavonoids) were investigated to verify the analgesic activity by using the writhing test in mice.
181,"8987111 | lignan | Gomisin A (Go), a lignan component of shizandra fruits, protects the liver from injury by acetaminophen (AAP)."
182,"6291543 | carbon disulfide | Diethyldithiocarbamate (DTC) and carbon disulfide (CS2), at nearly equimolar oral dose levels, protected mice against liver damage induced by carbon tetrachloride, chloroform, bromotrichloromethane, thioacetamide, bromobenzene, furosemide, acetaminophen, dimethylnitrosamine and trichloroethylene, as evidenced by the suppression of elevations in plasma GPT activity and liver calcium content, and of histopathological alterations."
183,"9120830 | oxalate | A thermodynamic analysis of the energy transformations occurring within pharmaceutical tablets during the unloading phase of compaction was performed on Avicel, calcium phosphate, acetaminophen, and calcium oxalate."
184,"25862331 | oxalate | Among these, control group treated with 12mM acetaminophen produced significantly elevated levels (50-80%) of lactate dehydrogenase (LDH), catalase (CAT), glutamate oxalate transaminase (GOT), glutamate pyruvate transaminase (GPT), and malondialdehyde (MDA), and significantly decreased the levels (60-75%) of superoxide dismutase (SOD) and glutathione peroxidase (GSH-Px)."
185,"18389098 | oxalate | This issue focuses on the following selection of drugs: 101M, 3F8; Abatacept, ABT-263, Adalimumab, AG-7352, Agatolimod sodium, Alfimeprase, Aliskiren fumarate, Alvimopan hydrate, Aminolevulinic acid hexyl ester, Ammonium tetrathiomolybdate, Anakinra, Aripiprazole, AS-1404, AT-9283, Atomoxetine hydrochloride, AVE-1642, AVE-9633, Axitinib, AZD-0530; Becocalcidiol, Belotecan hydrochloride, Bevacizumab, BG-9928, BIBF-1120, BMS-275183, Bortezomib, Bosentan; Catumaxomab, Cetuximab, CHR-2797, Ciclesonide, Clevidipine, Cypher, Cytarabine/daunorubicin; Darifenacin hydrobromide, Darunavir, Denosumab, Desvenlafaxine succinate, Disufenton sodium, Duloxetine hydrochloride, Dutasteride; Eculizumab, Efalizumab, Eicosapentaenoic acid/docosahexaenoic acid, Eplerenone, Epratuzumab, Erlotinib hydrochloride, Escitalopram oxalate, Ethynylcytidine, Etravirine, Everolimus, Ezetimibe; Fulvestrant; Garenoxacin mesilate, Gefitinib, Gestodene; HI-164, Hydralazine hydrochloride/isosorbide dinitrate; Icatibant acetate, ICX-RHY, Idraparinux sodium, Indacaterol, Ispronicline, Ivabradine hydrochloride, Ixabepilone; KB-2115, KW-2449; L-791515, Lapatinib ditosylate, LGD-4665, Licofelone, Liposomal doxorubicin, Lisdexamfetamine mesilate, Lumiracoxib; Methoxy polyethylene glycol-epoetin-beta, Miglustat, Mipomersen sodium, Mitumprotimut-T, MK-0822A, MK-0974; Nelarabine; Obatoclax mesylate, Olmesartan medoxomil, Olmesartan medoxomil/hydrochlorothiazide; Paliperidone, Palonosetron hydrochloride, Panitumumab, Pegfilgrastim, Peginterferon alfa-2a, Pemetrexed disodium, Perospirone hydrochloride, Pertuzumab, Pimecrolimus, Pitrakinra, Pixantrone maleate, Posaconazole, Pregabalin; Quercetin; RALGA, Raltegravir potassium, Ranelic acid distrontium salt, rhHistone 1.3, Rimonabant, Rivaroxaban, Rosuvastatin calcium, RTS,S/SBAS2; Satraplatin, SNDX-275, Sodium butyrate, Solifenacin succinate, Sorafenib, SU-14813, Sunitinib malate; Tadalafil, Tafenoquine succinate, Tamatinib fosdium, Taxus, Telbivudine, Telmisartan/hydrochlorothiazide, Temsirolimus, Tiotropium bromide, Tipranavir, Tocilizumab, Trabectedin, Tramadol hydrochloride/acetaminophen; Ulipristal acetate, Uracil, Ursodeoxycholyltaurine; Valdecoxib, Vardenafil hydrochloride hydrate, Varenicline tartrate, Vildagliptin, Vinflunine, Vitespen, Vorinostat; ZK-EPO, Zoledronic acid monohydrate."
186,"15357915 | 17alpha-ethynylestradiol | The most potent inhibition was observed for the reaction between 17alpha-ethynylestradiol and UGT1A1 (K(i) = 10.5 microM), and the weakest interaction was detected for acetaminophen and UGT1A9 (IC(50) > 1 mM)."
187,"12557248 | hibiscus sabdariffa | This work therefore seeks to induce liver damage in mice using single dose (25 0mg/kg) of acetaminophen and to evaluate the possible protective effects of administration (100mg/kg) of some medicinal plants (Kigelia africana, Calotropis procera, Hibiscus sabdariffa and Alchornea cordifolia) on PCM-induced liver damage in mice."
188,"25119859 | prunus | In the present study, we investigated the role of almond (Prunus amygdalus) skin procyanidins (ASP) in regulating the protein expression of phase II detoxifying and antioxidant enzymes in HepG2 cells and acetaminophen (APAP)-treated hepatotoxic mice."
189,"15763370 | beta-amyrin | In the search of hepatoprotective agents from natural sources, alpha- and beta-amyrin, a triterpene mixture isolated from the trunk wood resin of folk medicinal plant, Protium heptaphyllum was tested against acetaminophen-induced liver injury in mice."
190,"23766864 | ginsenoside rg3 | Previously, we found that Korean red ginseng suppressed acetaminophen (APAP)-induced hepatotoxicity via alteration of its metabolic profile involving GSTA2 induction and that ginsenoside Rg3 was a major component of this gene induction."
191,"26179383 | steller sea lion | From the results of measurements of uridine diphosphate-glucuronosyltransferase (UGT) activity using liver microsomes, the Steller sea lion, Northern fur seal, and Caspian seal showed UGT activity toward 1-hydroxypyrene and acetaminophen as low as in cats, which was significantly lower than in rat and dog."
192,"17045319 | kaempferol | This occurred as a result of CYP3A induction by ginkgolide A because triacetyloleandomycin (TAO), a specific inhibitor of CYP3A catalytic activity, completely blocked the effect of ginkgolide A. Ginkgolide B, ginkgolide C, ginkgolide J, quercetin, kaempferol, isorhamnetin, and isorhamnetin-3-O-rutinoside did not alter the extent of LDH leakage by acetaminophen."
193,"17305373 | naphthalene | Altogether, 33 unique new protein targets for bromobenzene metabolites were identified and compared to those known for acetaminophen, naphthalene, butylated hydroxytoluene, benzene, thiobenzamide, and halothane via a target protein database available at http://tpdb.medchem.ku.edu:8080/protein_database/."
194,"19269644 | naphthalene | The model compounds tested for SFC separation are acetaminophen, metoprolol, fenoprofen, ibuprofen, naphthalene, and testosterone."
195,2299686 | naphthalene | Cataracts were induced by administration of either acetaminophen or naphthalene to the pretreated mice.
196,2299686 | naphthalene | CySSME was coadministered with either acetaminophen or naphthalene to other groups of mice.
197,"8603877 | naphthalene | To assess the efficacy of 2-mercaptoethanol/L-cysteine mixed disulfide (CySSME) as an L-cysteine prodrug suitable for glutathione biosynthesis in rat lenses in vitro, as an agent for the prevention of acetaminophen- and naphthalene-induced murine cataract in genetically-susceptible mice, and as an agent for maintenance of near-normal glutathione levels in lenses and livers of mice subjected to acetaminophen and naphthalene at cataractogenic doses."
198,"20020764 | methyl salicylate | The initial performance of the microplasma device has been evaluated by ionizing samples containing dimethyl sulfoxide (DMSO), dimethylformamide (DMF), methyl salicylate, caffeine, l-leucine, l-histidine, loratadine, ibuprofen, acetaminophen, acetylsalicylic acid, and cocaine in various forms."
199,"24551872 | methyl salicylate | Active ingredients from soft and liquid formulations, such as Icy Hot cream (methyl salicylate) and Nyquil cold medicine (acetaminophen, dextromethorphan, doxylamine) were also detected."
200,"9630389 | vinegar | The aim of the study was to evaluate the possible influence of acetic acid (administered as vinegar) on the postprandial glucose and insulin responses, and the potential involvement of a modified gastric emptying rate was studied by use of paracetamol as a marker."
201,"2364459 | phosphatidylcholine | Intravenous administration of soybean phosphatidylcholine liposomes containing different amounts of tocopherol acetate leads to a dose and time dependent increase of mouse liver tocopherol content, which was not observed when the preparation was given orally."
202,"2364459 | phosphatidylcholine | When benzo[a]pyrene pretreated mice intoxicated with 400 mg/kg AAP were pretreated 2 h before with 1 g/kg phosphatidylcholine liposomes containing 4 mg/kg vitamin E acetate, these animals were protected against liver damage."
203,"9501466 | phosphatidylcholine | The release of acetaminophen (AAP) from tablets containing phospholipids was examined using hydrogenated soybean phospholipid (HSL) and its main components, phosphatidylcholine (PC), phosphatidylethanolamine (PE) and phosphatidylinositol (PI), although the PI was not well purified (PI rich)."
204,"2571471 | hydroxamic acid | The hydroxamic acid of 3'-hydroxyacetanilide (AMAP) was synthesized to test the hypothesis that different reactive metabolites of AMAP and acetaminophen account for similarities in covalent binding of the two positional isomers to hepatic proteins, but for differences in their ability to cause hepatotoxicity."
205,19459732 | anthocyanins | The present study was undertaken to examine the protective effects of an anthocyanin fraction (AF) obtained from purple-fleshed sweet potato on acetaminophen (paraceptamol [APAP])-induced hepatotoxicity in mice and to determine the mechanism involved.
206,"17132218 | anthocyanins | This study investigated the mutagenic, anti-mutagenic and cytotoxic effects of acetone extract of raspberry, Rubus idaeus L. (v. Ottawa) Rosaceae, and the isolated and characterized ellagitannin and anthocyanin fractions thereof, suitable for food applications."
207,"25394398 | atlantic salmon | Atlantic salmon (Salmo salar) were exposed to Acetaminophen: 54.77  34.67; Atenolol: 11.08  7.98, and Carbamazepine: 7.85  0.13 gL(-1) for 5 days."
208,9406902 | cichorium intybus | The hepatoprotective activity of aqueous-methanolic extract of Cichorium intybus seeds was investigated against acetaminophen and CCl(4)-induced hepatic damage.
209,"15319808 | gallium | This issue focuses on the following selection of drugs: 166Ho-DOTMP 5A8; A-179578, abetimus sodium, adefovir dipivoxil, AGI-1067, AIDSVAX gp120 B/B, AK-602, alefacept alemtuzumab, aliskiren fumarate, ALVAC vCP1433, ALVAC vCP1452, anecortave acetate, arzoxifene hydrochloride, atazanavir sulfate, atlizumab, avasimibe; Binodenoson, BMS-488043; Choriogonadotropin alfa, ciclesonide, COL-1621, CVT-3146, CVT-E002, Cypher; Daptomycin, darbepoetin alfa, darunavir, D-D4FC, deferasirox, desloratadine, desmoteplase, duloxetine hydrochloride, DX-9065a; E-5564, efalizumab, emfilermin, emivirine, emtricitabine, enfuvirtide, estradiol acetate, ezetimibe; Frovatriptan; Gallium maltolate, gefitinib; HIV-1 Immunogen, human insulin; Iguratimod, IL-4/IL-13 Trap, imatinib mesylate, inhaled insulin, insulin glargine, irofulven, ISS-1018, ivabradine hydrochloride; Lutropin alfa; Melatonin; Nesiritide; O6-Benzylguanine, omapatrilat, oritavancin, ospemifene; Parecoxib sodium, peginterferon alfa-2a, pexelizumab, pimecrolimus, pirfenidone, pramlintide acetate, prasterone sulfate PT-141; Rasburicase, razaxaban hydrochloride, recombinant malaria vaccine, rhBMP-2/ACS, roflumilast, rosiglitazone maleate/metformin hydrochloride, rotavirus vaccine; SCH-D, sitaxsentan sodium, solifenacin succinate; Targinine hydrochloride, taxus, TER-199, tramadol hydrochloride/acetaminophen; Valdecoxib, valganciclovir hydrochloride, vatalanib succinate, VEG Trap(R1R2); Ximelagatran; Yttrium Y90 Epratuzumab."
210,"19523510 | citrinin | Nephrotoxic compounds (5-fluorouracil, gentamicin, cisplatin, acetaminophen, para-aminophenol, potassium dichromate, ibuprofen, doxorubicin, cyclosporine, citrinin, puromycin) were used to determine the potential of this method to detect proximal tubule toxicity of compounds."
211,"11728749 | hydrogen sulfide | Male Swiss mice were treated with sodium hydrogen sulfide, a H(2)S donor, 30 min after acetaminophen administration."
212,"23692300 | hydrogen sulfide | The sensor exhibited excellent analytical performance in phosphate buffered saline, including a NO sensitivity of 1.4 pA nM(-1), a limit of detection (LOD) of 840 pM, and selectivity over nitrite, ascorbic acid, acetaminophen, uric acid, hydrogen sulfide, ammonium, ammonia, and both protonated and deprotonated peroxynitrite (selectivity coefficients of -5.3, -4.2, -4.0, -5.0, -6.0, -5.8, -3.8, -1.5, and -4.0, respectively)."
213,25801321 | shrimp | It was likely that the inhibitory effects of acetaminophen on shrimp neurological enzymes were more severe than on the planarian.
214,"17132218 | rubus idaeus | This study investigated the mutagenic, anti-mutagenic and cytotoxic effects of acetone extract of raspberry, Rubus idaeus L. (v. Ottawa) Rosaceae, and the isolated and characterized ellagitannin and anthocyanin fractions thereof, suitable for food applications."
215,"10774834 | ribonuclease | In addition, mRNA expression of MIP-2 and KC were upregulated in livers of acetaminophen-treated animals as determined by ribonuclease protection assay."
216,"11896290 | ribonuclease | Ribonuclease protection assays compared the effects of acetaminophen and E2 on expression of selected genes (c-myc, c-fos, cyclin D1, bcl-2, bax, gadd45, mcl-1, p53, p21(CIP1/WAF1), and bcl-xL) in E2-responsive breast cancer (MCF-7) and endometrial adenocarcinoma (Ishikawa) cells as well as in E2-nonresponsive (MDA-MB-231) breast cancer cells."
217,28234915 | formononetin | To examine the effects of formononetin (FMN) on Acetaminophen (APAP)-induced liver injury in vitro and in vivo.
218,"8125211 | hederagenin | Glycyrrhizin, alpha-GA, and beta-GA decreased acetaminophen-induced liver injury, whereas hederagenin, HAG, and HA did not protect against any of the hepatotoxicants."
219,"8878354 | acetyl-coa | Chemical biopsy of glucuronic acid by acetaminophen also permits the study of glycogen synthesis whereas chemical biopsies of liver glutamine by phenylacetate and of cytosolic acetyl-CoA by sulfamethoxazole give important information concerning, respectively, Krebs cycle activity and glconeogenesis and on lipogenesis and cholesterol synthesis."
220,"2863101 | acetyl-coa | Similarly, in vivo acetylation of isoniazid was diminished (23%) in conjunction with hepatic N-acetyltransferase activity, though hepatic acetyl-CoA content was elevated after model trauma."
221,2058663 | acetyl-coa | Xenobiotic probes were used to sample hepatic cytosolic acetyl-CoA [acetylated sulfamethoxazole (SMX)] and UDP-glucose (glucuronidated acetaminophen) in vivo during [U-14C]glucose infusions.
222,21515333 | rhein | This study investigated the possible protective effects and mechanism of rhein on Acetaminophen (APAP)-induced hepatotoxicity and nephrotoxicity in rats.
223,"19238284 | 3,4-dihydroxyphenylacetic acid | The electrode array device was characterized using a mixture of biologically relevant analytes and xenobiotics: norepinephrine, 4-aminophenol, acetaminophen, uric acid, and 3,4-dihydroxyphenylacetic acid."
224,"1690270 | 3,4-dihydroxyphenylacetic acid | When microdialysis probes were tested in a stirred in vitro solution, large and statistically significant differences among the three membranes in extraction of acid metabolites (3,4-dihydroxyphenylacetic acid, 5-hydroxyindoleacetic acid, and homovanillic acid) and acetaminophen were found."
225,17637489 | z. officinale | Further the hepatic antioxidant status was enhanced in the Z. officinale plus acetaminophen treated group than the control group.
226,17637489 | z. officinale | The results of the present study concluded that the hepatoprotective effect of aqueous ethanol extract of Z. officinale against acetaminophen-induced acute toxicity is mediated either by preventing the decline of hepatic antioxidant status or due to its direct radical scavenging capacity.
227,"21783952 | hemin | The therapeutic potential of hemin, the heme oxygenase-1 inducer, was investigated against renal damage induced by acute acetaminophen overdose in rats."
228,"21783952 | hemin | Hemin was given as a single s.c. injection (40mol/kg), 1h following acetaminophen administration."
229,21783952 | hemin | Hemin treatment restored blood urea nitrogen and serum creatinine levels that were elevated by acetaminophen.
230,"21783952 | hemin | Hemin also compensated deficits in the antioxidant defense mechanisms (reduced glutathione, and catalase and superoxide dismutase activities), and suppressed lipid peroxidation in renal tissue resulted from acetaminophen administration."
231,"21783952 | hemin | Hemin attenuated the acetaminophen-induced elevations in renal tumor necrosis factor- and nitric oxide levels, and caspase-3 activity."
232,"21783952 | hemin | Additionally, hemin ameliorated acetaminophen-induced renal damage observed by light microscopic examination."
233,21783952 | hemin | It was concluded that hemin represents a potential therapeutic option to protect renal tissue from the detrimental effects of acute acetaminophen overdose.
234,"12051994 | hemin | Pretreatment of rats with hemin was found to prevent acetaminophen-induced hepatotoxicity, as measured histologically and biochemically by decreased serum transaminase levels."
235,"27382354 | bupropion | Acetaminophen, ibuprofen, nabumetone, and bupropion inhibited TRESK, but had no effect on TREK-2."
236,"24798647 | bupropion | We present a case of physostigmine continuous infusion for the treatment of antimuscarinic symptoms in a polydrug overdose due to the ingestion of diphenhydramine along with bupropion, citalopram, acetaminophen, and naproxen."
237,"22652317 | d-sorbitol | Seven compounds expected to have no effect on neuronal function were tested as ""negatives"" (glyphosate, acetaminophen, salicylic acid, paraquat, saccharin, d-sorbitol and amoxicillin)."
238,"17284318 | d-serine | Here, we characterize the effect on pain behavior of lacosamide, a member of a family of functionalized amino acids that are analogues of endogenous amino acids and D-serine, in the monosodium iodoacetate rat model for osteoarthritis in comparison to diclofenac and morphine."
239,"9120830 | calcium oxalate | A thermodynamic analysis of the energy transformations occurring within pharmaceutical tablets during the unloading phase of compaction was performed on Avicel, calcium phosphate, acetaminophen, and calcium oxalate."
240,"10385456 | apple | In an open-label clinical study, a single dose of acetaminophen was administered to 20 infants with approximately one fluid ounce of infant formula or apple juice by pediatric nurses using the Rx medibottle (The Medicine Bottle Company)."
241,"12811710 | apple | Thirteen participants received 2000 mg acetaminophen and the remaining 33 received 3000 mg. After 3 hours, half of the participants (22 of 46) received 75 g of SAC (Requa, Greenwich, CT) orally as a slurry in 8 oz of apple juice."
242,"23016277 | luteolin | The objective of this study was to investigate corresponding anti-oxidative and anti-inflammatory activities of luteolin, using acetaminophen-treated mice as a model system."
243,"23016277 | luteolin | Luteolin administration significantly decreased acetaminophen-induced serum alanine aminotransferase (ALT), aspartate aminotransferase (AST), tumor necrosis factor alpha (TNF-), interleukin 6 (IL-6), malondialdehyde (MDA) levels, as well as glutathione (GSH) depletion and decrease of superoxide dismutase (SOD)."
244,"23016277 | luteolin | Moreover, luteolin down-regulated acetaminophen-induced nitrotyrosine (NT) formation and endoplasmic reticulum (ER) stress."
245,"23016277 | luteolin | These results suggest the presence of anti-oxidative, anti-inflammatory and anti-ER stress properties of luteolin in response to acetaminophen-induced liver injury in mice."
246,"1185577 | vanillin | The determination of acetaminophen is based on the ability of its hydrolytic product, p-aminophenol, to produce an intensive yellow color with vanillin."
247,26165293 | l-ascorbate | The oxidation current owing to electrochemical interferents such as L-ascorbate and acetaminophen was 1/8 times of the current observed on the unprotected electrode.
248,"6148834 | l-ascorbate | Studies were made on the effects of butylated hydroxyanisole (BHA), butylated hydroxytoluene (BHT), sodium L-ascorbate (SA), ethoxyquin (EQ) and acetaminophen (AAF) on the induction of neoplastic lesions in the liver, kidney or urinary bladder of rats initiated by N-ethyl-N-hydroxyethylnitrosamine (EHEN), diethylnitrosamine (DEN) or N-butyl-N-(4-hydroxybutyl)nitrosamine (BBN)."
249,23533782 | tofu | The antioxidant and hepatoprotective properties of tofu using acetaminophen to induce liver damage in albino rats were evaluated.
250,"23533782 | tofu | Rats fed with various tofus and acetaminophen had their serum ALP, ALT, AST, and LDH activities; total cholesterol; and bilirubin levels significantly (P < 0.05) reduced, and total protein and albumin concentrations increased when compared with basal diet and acetaminophen administered group."
251,"27604786 | coconut | We evaluated abundance, habitat type, and snake size (i.e., age) within two study sites on Guam, a secondary limestone forest (upland) and an abandoned coconut plantation (coastal), to determine how experimentally dosing snakes with acetaminophen is likely to influence carrion availability."
252,18518665 | morin | Efficacy of morin was evaluated against oxidative stress-mediated damage to primary hepatocytes by tert-butyl hydroperoxide (tBHP) and acetaminophen.
253,17892525 | morin | The study supports the inhibitory action of morin against PHLPP2-regulated Nrf2-suppression and hence indentifies Nrf2-potentiating property of morin that may be exploited in developing novel therapeutic strategy to address AILI.
254,"19543536 | morin | Morin, a bioflavonoid given as co- and pre-treatment with acetaminophen significantly prevented the toxicity induced damage by constitutively stabilizing Nrf2 nuclear retention."
255,"19543536 | morin | Morin, as a potent Nrf2 inducer accorded protection against acetaminophen induced renal damages by its molecular intervention with Akt-1/Gsk3/Fyn kinase pathway via PHLPP2 de-activation."
256,"24466725 | sodium nitrite | The employed method of determination was based on the acetaminophen reaction with sodium nitrite, which yields yellow colour of solution in the presence of sodium hydrate."
257,"25562760 | sodium nitrite | The specific combination of xerogels formed from specific silane precursors, including propyl-trimethoxysilane, isobutyl-trimethoxysilane, octyl-trimethoxysilane, and hydroxymethyl-triethoxysilane, exhibit impressive dynamic and linear ranges of detection (e.g., 24-28 mM glucose) and low response times, as well as significant discrimination against common interferent species such as acetaminophen, ascorbic acid, sodium nitrite, oxalic acid, and uric acid as determined by selectivity coefficients."
258,"15761113 | 5-hydroxytryptophol | Initial studies using different substrates (serotonin, 5-hydroxytryptophol, 4-nitrophenol, acetaminophen, and valproic acid) showed similar results with 2-fold higher glucuronidation by UGT1A6(*)2 (S7A/T181A/R184S) compared with UGT1A6(*)1 (reference), and intermediate activities for other variants."
259,"16809136 | pyrrole | In order to prepare a biosensor for the determination of uric acid, electropolymerization of pyrrole on Pt surface was carried out with an electrochemical cell containing pyrrole, ferrocene (as a electron mediator) and tetrabutylammonium tetrafluoroborat in acetonitrile by cyclic voltammetry between 0.0 and 1.0 V (vs. Ag/AgCl) at a scan rate of 50 mV/s upon Pt electrode."
260,17045319 | g. biloba | G. biloba extract (25 or 50 mug/ml once every 24 h for 72 h) potentiated LDH leakage by acetaminophen (10 mM for 24 h; added at 48 h after initiation of extract pretreatment).
261,"17045319 | g. biloba | In summary, G. biloba pretreatment potentiated acetaminophen toxicity in cultured rat hepatocytes and ginkgolide A contributed to this novel effect of the extract by inducing CYP3A."
262,"15886002 | l-dopa | A physiological level of neurotransmitters and their derivatives including dopamine, l-dopa, adrenaline, noradrenaline and homovanillic acid as well as ascorbic acid, uric acid and acetaminophen do not affect the determination of DOPAC."
263,"26261286 | l-dopa | More specifically, the altered pharmacology and toxicology of salicylazosulfapridine, digoxin, l-dopa, acetaminophen, caffeic acid, phosphatidyl choline, carnitine, sorivudine, irinotecan, nonsteroidal anti-inflammatory drugs, heterocyclic amines, melamine, nitrazepam, and lovastatin will be reviewed."
264,25862331 | cyprinus carpio | The present study aims to evaluate the hepatoprotective and antioxidant effects of gold nanoparticles (GNaP) biosynthesized through the mediation of Azolla microphylla and A. microphylla extract on acetaminophen-induced hepatocyte damage in common carp fish (Cyprinus carpio L.).
