,0
0,"2864430 | pyridoxamine | Pyridoxamine inhibits rabbit and pig plasma benzylamine oxidase (BAO), the diamine oxidase of pig kidney and the lysyloxidase of pig aorta in-vitro."
1,"25915461 | salvigenin | In the present study, four Sideritis flavonoids, xanthomicrol (1), isoscutellarein 7-O-[6'''-O-acetyl--D-allopyranosyl-(12)]--D-glucopyranoside (2), isoscutellarein 7-O-[6'''-O-acetyl--D-allopyranosyl-(12)]-6''-O-acetyl--D-glucopyranoside (3) and salvigenin (4) were docked computationally into the active site of the human monoamine oxidase isoforms (hMAO-A and hMAO-B) and were also investigated for their hMAO inhibitory potencies using recombinant hMAO isoenzymes."
2,1294893 | dehydroepiandrosterone | To evaluate the acute effect of dehydroepiandrosterone (DHEA) on monoamine oxidase (MAO) activity in the corpus striatum (CS) and the nucleus accumbens (NAc) in vivo and in vitro.
3,12900932 | l-histidine | This finding was supported by the elevated l-histidine decarboxylase and reduced monoamine oxidase type B expressions in the BA infants with severe fibrosis.
4,"2809587 | l-histidine | The pattern of MAOB expression generally matched the previously reported patterns of expression of the plasma 5-HT transporter expression or of the histamine biosynthetic enzyme L-histidine decarboxylase, suggesting a role for MAOB in fine regulation of the levels of 5-HT and histamine in the developing embryo."
5,"4997889 | l-histidine | The tissue immunoreactivity corresponded to authentic histamine or tele-methylhistamine, as shown by (a) the parallel 125I-tracer displacement curves, (b) the similar elution patterns from HPLC columns, (c) the regional levels of histamine and tele-methylhistamine in brain, similar to those obtained with other methods, and (d) the clearcut effects of treatments with inhibitors of L-histidine decarboxylase or monoamine oxidase."
6,"63382 | l-histidine | Upon the addition of histidine and histamine, the copper containing monoamine oxidase (MAO) catalyzes the oxidation of L-ascorbic acid (AsA) by dissolved oxygen, in which the consumed oxygen was finally converted to hydrogen peroxide, according to Michaelis-Menten kinetics (Km) = 1.97 mM, upon the addition of 5 x 10(-5) M L-histidine at 35 degrees C and pH 8.5)."
7,"10988329 | l-glutamate | Further examination of the protective action of flupirtine and retigabine against L-glutamate toxicity showed that it had no influence on monoamine oxidase (monoamine: oxygen oxidoreductase (deaminating), EC 1.4.3.4., MAO) activity."
8,"10988329 | l-glutamate | Thus, flupirtine and retigabine provided protection against cystine deprivation and L-glutamate toxicity but did not protect against L-glutamate under cystine-free conditions indicating that both compounds are sufficiently effective to compensate the oxidative stress elicited by cystine deprivation but not excessive activity of monoamine oxidase after L-glutamate treatment."
9,"11405259 | l-glutamate | In the present study, several dietary antioxidant compounds, monoamine oxidase inhibitors and ergogenic compounds were examined for protective action against neurotoxicity induced by L-glutamate (15 mM) or MPP+-HCl (5 mM) in a plastic adhering variant of murine pheochromocytoma cells."
10,"25061726 | cudraflavone a | Cudraflavone B is a prenylated flavone isolated from C. tricuspidata which has shown anti-proliferative activity, mouse brain monoamine oxidase (MAO) inhibitory effects, apoptotic actions in human gastric carcinoma cells and mouse melanoma cells, and hepatoprotective activity."
11,"17608532 | cudraflavone a | Cudratricusxanthone A (7), cudraflavanone A (10), and cudraflavone B (11) showed moderate inhibitory effects on mouse brain monoamine oxidase (MAO) with IC50 values of 88.3, 89.7, and 80.0 microM, respectively."
12,"9091408 | globulin | A1C = hemoglobin A1c AACE = American Association of Clinical Endocrinologists ACE = American College of Endocrinology ACSM = American College of Sports Medicine ADA = American Diabetes Association ADAPT = Arthritis, Diet, and Activity Promotion Trial ADHD = attention-deficit hyperactivity disorder AHA = American Heart Association AHEAD = Action for Health in Diabetes AHI = apnea-hypopnea index ALT = alanine aminotransferase AMA = American Medical Association ARB = angiotensin receptor blocker ART = assisted reproductive technology AUC = area under the curve BDI = Beck Depression Inventory BED = binge eating disorder BEL = best evidence level BLOOM = Behavioral Modification and Lorcaserin for Overweight and Obesity Management BLOSSOM = Behavioral Modification and Lorcaserin Second Study for Obesity Management BMI = body mass index BP = blood pressure C-SSRS = Columbia Suicidality Severity Rating Scale CAD = coronary artery disease CARDIA = Coronary Artery Risk Development in Young Adults CBT = cognitive behavioral therapy CCO = Consensus Conference on Obesity CHF = congestive heart failure CHO = carbohydrate CI = confidence interval COR-I = Contrave Obesity Research I CPG = clinical practice guideline CV = cardiovascular CVD = cardiovascular disease DASH = Dietary Approaches to Stop Hypertension DBP = diastolic blood pressure DEXA = dual-energy X-ray absorptiometry DPP = Diabetes Prevention Program DSE = diabetes support and education EL = evidence level ED = erectile dysfunction ER = extended release EWL = excess weight loss FDA = Food and Drug Administration FDG = 18F-fluorodeoxyglucose GABA = gamma-aminobutyric acid GERD = gastroesophageal reflux disease GI = gastrointestinal GLP-1 = glucagon-like peptide 1 HADS = Hospital Anxiety and Depression Scale HDL-c = high-density lipoprotein cholesterol HR = hazard ratio HTN = hypertension HUNT = Nord-Trndelag Health Study ICSI = intracytoplasmic sperm injection IFG = impaired fasting glucose IGT = impaired glucose tolerance ILI = intensive lifestyle intervention IVF = in vitro fertilization LAGB = laparoscopic adjustable gastric banding LDL-c = low-density lipoprotein cholesterol LES = lower esophageal sphincter LSG = laparoscopic sleeve gastrectomy LV = left ventricle LVH = left ventricular hypertrophy LVBG = laparoscopic vertical banded gastroplasty MACE = major adverse cardiovascular events MAOI = monoamine oxidase inhibitor MI = myocardial infarction MNRCT = meta-analysis of non-randomized prospective or case-controlled trials MRI = magnetic resonance imaging MUFA = monounsaturated fatty acid NAFLD = nonalcoholic fatty liver disease NASH = nonalcoholic steatohepatitis NES = night eating syndrome NHANES = National Health and Nutrition Examination Surveys NHLBI = National Heart, Lung, and Blood Institute NHS = Nurses' Health Study NICE = National Institute for Health and Care Excellence OA = osteoarthritis OGTT = oral glucose tolerance test OR = odds ratio OSA = obstructive sleep apnea PHQ-9 = Patient Health Questionnaire PCOS = polycystic ovary syndrome PCP = primary care physician POMC = pro-opiomelanocortin POWER = Practice-Based Opportunities for Weight Reduction PPI = proton pump inhibitor PRIDE = Program to Reduce Incontinence by Diet and Exercise PSA = prostate specific antigen QOL = quality of life RA = receptor agonist RCT = randomized controlled trial ROC = receiver operator characteristic RR = relative risk RYGB = Roux-en-Y gastric bypass SAD = sagittal abdominal diameter SBP = systolic blood pressure SCOUT = Sibutramine Cardiovascular Outcome Trial SG = sleeve gastrectomy SHBG = sex hormonebinding globulin SIEDY = Structured Interview on Erectile Dysfunction SNRI = serotonin-norepinephrine reuptake inhibitors SOS = Swedish Obese Subjects SS = surveillance study SSRI = selective serotonin reuptake inhibitors STORM = Sibutramine Trial on Obesity Reduction and Maintenance TCA = tricyclic antidepressant TONE = Trial of Nonpharmacologic Intervention in the Elderly TOS = The Obesity Society T2DM = type 2 diabetes mellitus UKPDS = United Kingdom Prospective Diabetes Study U.S = United States VAT = visceral adipose tissue VLDL = very low-density lipoprotein WC = waist circumference WHO = World Health Organization WHR = waist-hip ratio WHtR = waist-to-height ratio WMD = weighted mean difference WOMAC = Western Ontario and McMaster Universities osteoarthritis index XENDOS = XEnical in the Prevention of Diabetes in Obese Subjects."
13,"15778090 | dihydroxyacetone | The data indicate that a rapid intracellular degradation of L-3,4-dihydroxyphenylalanine and tyramine (at 100 and 200 microM concentrations) is accompanied by 25-40% decrease in glucose production from pyruvate, alanine + glycerol + octanoate and dihydroxyacetone due to augmented generation of hydrogen peroxide via monoamine oxidase B, resulting in a decline of glutathione redox state by 40%."
14,"7971723 | n-acetyl-l-cysteine | In addition, 4'-IAPP treatment significantly increases intracellular reactive oxygen species (ROS) and decreases glutathione (GSH) levels in SH-SY5Y cells, and cell death is significantly attenuated by the common antioxidants alpha-tocopherol, N-acetyl-l-cysteine and GSH, but not by the nonspecific caspase inhibitor N-benzyloxycarbonyl-Val-Ala-Asp-fluoromethyl ketone."
15,"22983620 | n-acetyl-l-cysteine | Furthermore, a monoamine oxidase inhibitor, pargyline, and antioxidants, N-acetyl-L-cysteine and glutathione, also did not affect the DA-induced expression of EC-SOD mRNA."
16,"2491914 | n,n-dimethylbenzylamine | Inhibition of the FAD-containing dimethylaniline monooxygenase (FDMAM, EC 1.14.13.8) by N,N-dimethylbenzylamine (N,N-DMB) resulted in some increase in cyclophosphamide mutagenicity only in spermatids."
17,"8589074 | n,n-dimethylbenzylamine | Support for this conclusion also comes from the observation that para-substituted N,N-dimethylbenzylamine analogues are competitive inhibitors and not substrates for monoamine oxidase B while the meta-substituted analogues are substrates, albeit poor ones."
18,27366756 | palmitate | Lower Maob expression was found in islets from db/db versus WT mice and in MIN6 -cells in response to palmitate and oleate treatment compared to vehicle.
19,"17077534 | sarsasapogenin | Moreover, sarsasapogenin showed a monoamine oxidase inhibitory activity in the mouse brain."
20,17077534 | sarsasapogenin | These findings suggest that the antidepressant activity of sarsasapogenin may involve the central monoaminergic neurotransmitter systems.
21,"8721213 | n-methyltyramine | Given orally, both substances influence the monoamine oxidase type A (MAO-A): N-methyltyramine acts as a competitive substrate, and 2-Me THBC is one of the most effective MAO-A-inhibitors."
22,"12899690 | 5-hydroxytryptophol | Serotonin was also metabolized to 5-hydroxytryptophol and 5-hydroxyindole acetic acid, probably through stepwise transformation catalyzed by monoamine oxidase, aldehyde dehydrogenase and aldehyde reductase."
23,"312499 | 5-hydroxytryptophol | The first three compounds were previously reported to be major metabolites produced from 5-hydroxytryptophan by the action of aromatic L-amino acid decarboxylase and monoamine oxidase, whereas the last three are formed by the cleavage of the indole ring by the action of indoleamine 2,3-dioxygenase."
24,3379825 | 5-hydroxytryptophol | A substantial amount of 5HT might be metabolized by platelet monoamine oxidase into 5HIAA and 5-hydroxytryptophol.
25,11600577 | 5-hydroxytryptophol | The type A monoamine oxidase (MAO) inhibitor clorgyline (10(-6) M) suppressed the metabolism of 5-HT into 5-hydroxytryptophol.
26,"10553643 | naphthalene | ), which exhibited monoamine oxidase (MAO) inhibition, three new naphthoquinone and/or naphthalene dimers (lemuninols A-C, 1-3) were isolated together with 4,6-dihydroxy-5-methoxy-2-methyl-naphthalene (8) and six known monomers (4-7, 9 and 10)."
27,"27866739 | naphthalene | For example, several chemicals such as diethylphthalate and naphthalene, and genes and related pathways, such as cholinergic receptor muscarinic 3 (CHRM3), estrogen receptor alpha1 (esr1), chemokine ligand 10 protein (CXCL10), tumor protein p53 (p53), and monoamine oxidase B (Maob), were identified as candidates for future assessments at these AOCs."
28,"1762051 | naphthalene | Pentanthrene type heterocyclic compounds, which contain oxazole, isoxazole, oxadiazole, thiazole, isothiazole, thiadiazole or pyrrole ring as C-ring, and naphthalene, quinoline, isoquinoline or quinoxaline ring as A.B-ring, were prepared, and their monoamine oxidase (MAO) inhibitory activities were examined."
29,"4376143 | d-xylose | When a mutant (Mao(-)) of Klebsiella aerogenes lacking an enzyme for tyramine degradation (monoamine oxidase) was grown with d-xylose as a carbon source, arylsulfatase was repressed by inorganic sulfate and repression was relieved by tyramine."
30,6264966 | cdp | Calculations indicated that the retention of monoamine oxidase inhibitory drugs on beta CDP column is mainly governed by their steric and lipophylic parameters.
31,"21190052 | isorhamnetin | Quercetin was equipotent with norharman as a monoamine oxidase A inhibitor and its metabolite, isorhamnetin, also inhibits."
32,8771201 | protoporphyrinogen ix | Protein database searches reveal significant homology between protoporphyrinogen oxidase and monoamine oxidase.
33,22745782 | protoporphyrinogen ix | The first crystal structure of apo-CRTI reveals that CRTI belongs to the flavoprotein superfamily comprising protoporphyrinogen IX oxidoreductase and monoamine oxidase.
34,11764944 | o-quinone | This suggests that H2O2 formed by the mitochondrial metabolism of monoamine oxidase then oxidised dopamine to cytotoxic o-quinone catalysed by P450.
35,"24548101 | o-quinone | The neurotoxic effects of aminochrome in dopaminergic neurons can be inhibited by: (i) preventing dopamine oxidation of the transporter that takes up dopamine into monoaminergic vesicles with low pH and dopamine oxidative deamination catalyzed by monoamino oxidase (ii) dopamine o-quinone, aminochrome and 5,6-indolequinone polymerization to neuromelanin and (iii) two-electron reduction of aminochrome catalyzed by DT-diaphorase."
36,"23184853 | umbelliferone | Umbelliferone and esculetin also prevented MPTP-dependent caspase 3 activation, an indicator of apoptosis, but did not inhibit monoamine oxidase activity."
37,"18064621 | isogentisin | Gentisin and isogentisin are xanthones showing potent inhibition of monoamine oxidase type A and B, amarogentin represents one of the bitter principles of Gentiana, responsible for its gastric-roborant effects."
38,"16631124 | trans-resveratrol | Trans-resveratrol, a phenolic compound presented in polygonum cuspidatum, was demonstrated previously to exert antidepressant-like effects through regulating monoaminergic system, oxidative/antioxidant defense and inflammatory response."
39,"16631124 | trans-resveratrol | Additional evidence from neurochemical (monoamines in the frontal cortex, hippocampus, and hypothalamus) and biochemical (monoamine oxidase, MAO activity) assays corroborated the synergistically elevated monoaminergic system after co-treatment with trans-resveratrol and piperine."
40,16631124 | trans-resveratrol | The present results indicate the effect of trans-resveratrol combined with piperine on depressive-like behaviors may be partly due to the potentiated activation of monoaminergic system in the brain.
41,2517372 | cu2+ | The diamine oxidase has almost normal cofactor levels (pyridoxal phosphate and Cu2+) but the cofactor levels for type B monoamine oxidase (flavin adenine dinucleotide and Fe2+) are lowered.
42,"11263670 | cu2+ | Cu2+ dose-dependently reduced flavin adenine dinucleotide (FAD)-dependent monoamine oxidase A (MAO-A) activity in a time-independent manner, with an IC50 value approximately 20 microM, whereas Mn2+ had no effect."
43,2500039 | cu2+ | We now report almost normal cofactor (pyridoxal phosphate and Cu2+) levels for diamine oxidase but lowered cofactor (flavin adenine dinucleotide and Fe2+) levels for type B monoamine oxidase.
44,6953456 | pterin | Cerebrospinal fluid levels of pterin cofactor were measured in off-medication schizophrenic patients and normal control subjects as one aspect of monoamine physiology in schizophrenia.
45,6953456 | pterin | Platelet monoamine oxidase activity correlated significantly with pterin levels in male schizophrenic and in female control subjects.
46,"4055794 | propanal | Although allylamine and N-cyclopropylbenzylamine appear to be oxidized by monoamine oxidase to give 3-(amino acid residue) propanal adducts, two different amino acids seem to be involved because of a difference in stability of the adducts."
47,"24116298 | ursolic acid | Ursolic acid has been docked with monoamine oxidase isoforms: MAO-A and MAO-B, LeuT (homologue of SERT, NET, DAT) and Human C-terminal CAP1 using GRIP docking methodology."
48,8129740 | pentanal | Determination of the formation of H2O2 and the aldehyde product of the oxidative cleavage of milacemide by purified monoamine oxidase-B from ox liver indicated that cleavage resulted solely in the formation of pentanal and glycinamide.
49,"1174546 | hg2+ | The amine oxidase reaction was markedly inhibited by metal ions (Cu2+, Hg2+, Ag+)."
50,"18800619 | rosmarinic acid | Neurochemical studies have also revealed that neither rosmarinic acid nor caffeic acid affects the uptake of monoamines or monoamine oxidase activity, which may underlie the therapeutic value of existing clinically effective antidepressants."
51,"27270453 | rosmarinic acid | In the present study, rosmarinic acid (RA) isolated from Blechnum brasiliense showed an invitro multifunctional profile characterized by antioxidant effects, and monoamine oxidases (MAO-A and MAO-B) and catechol-O-methyl transferase (COMT) inhibition."
52,"12167468 | rosmarinic acid | The aim of the present study was to examine (i) whether caffeic acid, a major metabolite of rosmarinic acid, also has antidepressive-like activity, and (ii) whether these substances inhibit either the uptake of monoamines to synaptosomes or mitochondrial monoamine oxidase activity."
53,"12167468 | rosmarinic acid | In neuropharmacological studies, neither rosmarinic acid (10 x (-9)-10 x (-3) M) nor caffeic acid (10 x (-9)-10 x (-3) M) affected either the uptake of monoamines to synaptosomes or mitochondrial monoamine oxidase activity in the mouse brain."
54,12167468 | rosmarinic acid | These results suggest that both caffeic acid and rosmarinic acid may produce antidepressive-like activity via some mechanism(s) other than the inhibition of monoamine transporters and monoamine oxidase.
55,"26181905 | acteoside | The antioxidant potential of OFE and acteoside in vivo was evaluated by estimating the following: activities of antioxidant enzymes, such as glutathione peroxidase and aging-related enzyme, particularly monoamine oxidase; contents of lipid peroxidation methane dicarboxylic aldehyde, advanced glycation end products, and 8-hydroxy-2'-deoxyguanosine (a DNA damage product); and levels of nuclear factor-erythroid 2-related factor 2."
56,"14697885 | 3,4-dihydroxyphenylglycolaldehyde | The monoamine oxidase (MAO) metabolites of norepinephrine (NE) or epinephrine (EPI) and of dopamine (DA) are 3,4-dihydroxyphenylglycolaldehyde (DOPEGAL) and 3,4-dihydroxyphenylacetaldehyde (DOPAL), respectively."
57,"9518674 | 3,4-dihydroxyphenylglycolaldehyde | 3,4-Dihydroxyphenylglycolaldehyde (DOPEGAL) is the monoamine oxidase A metabolite of norepinephrine (NE) and epinephrine."
58,"9878889 | 3,4-dihydroxyphenylglycolaldehyde | 3,4-Dihydroxyphenylglycolaldehyde (DOPEGAL) is the neurotoxic monoamine oxidase A (MAO-A) metabolite of norepinephrine (NE)."
59,"10452806 | 3,4-dihydroxyphenylglycolaldehyde | We recently described the chemical synthesis of 3, 4-dihydroxyphenylacetaldehyde and 3,4-dihydroxyphenylglycolaldehyde, the monamine oxidase metabolites of dopamine and noradrenaline, respectively."
60,"9237550 | 3,4-dihydroxyphenylglycolaldehyde | 3,4-Dihydroxyphenylglycolaldehyde (DOPEGAL) is the monoamine oxidase A metabolite of norepinephrine and epinephrine."
61,"8813375 | 3,4-dihydroxyphenylglycolaldehyde | 3,4-Dihydroxyphenylglycolaldehyde (DOPEGAL) is the monoamine oxidase A (MAO-A) metabolite of norepinephrine (NE) and epinephrine (Epi)."
62,"11164826 | 3,4-dihydroxyphenylglycolaldehyde | 3,4-Dihydroxyphenylglycolaldehyde is the monoamine oxidase-A metabolite of two catecholamine neurotransmitters, epinephrine and norepinephrine."
63,"2817346 | 3,4-dihydroxyphenylglycolaldehyde | The monoamine oxidase A metabolite of noradrenaline, 3,4-dihydroxyphenylglycolaldehyde, is the precursor of 3,4-dihydroxymandelic acid, and 3,4-dihydroxyphenylglycol, metabolites of noradrenaline."
64,"11532332 | 3,4-dihydroxyphenylglycolaldehyde | 3,4-Dihydroxyphenylacetaldehyde (DOPAL) and 3,4-dihydroxyphenylglycolaldehyde (DOPEGAL), the monoamine oxidase (MAO) metabolites of dopamine (DA) and norepinephrine (NE), respectively, are toxic to catecholamine (CA) neurons in vitro and in vivo."
65,"23222680 | 5,10-methylenetetrahydrofolate | One of them is activity of flavin-dependent enzymes such as flavin-containing monooxygenase (FMO)(GS-OX1), FAD-dependent 5,10-methylenetetrahydrofolate reductase and flavin-dependent monoamine oxidase."
66,"2611933 | sennoside a | Four (in total) compounds with inhibitory effects on the activity of bovine serum monoamine oxidase were isolated from the methanol-water extracts of Rhei Rhizoma (Daiou) and Sennae Folium (Senna), and identified as sennosides A, B, E and F. Among them, sennosides A and B were obtained from both Rhei Rhizoma and Sennae Folium, while sennosides E and F were detected only in the former."
67,"24920136 | oleanolic acid | Although monoamine oxidase activity remained unaltered by oleanolic acid, chronic administration of oleanolic acid augmented hippocampal BDNF level."
68,"15120460 | physcion | A total of seventeen phytochemicals including seven alkaloids (piperine, strychnine, brucine, stachydrine, tetrandrine, frangchinoline and sinomenine), four phenols (paeonol, honokiol, magnolol and eugenol) and six anthraquinones (emodin, rhein, chrysorphanol, aloe-emodin, physcion and 1,8-dihydroxyanthraquinone) was examined for inhibitory activity of monoamine oxidase (MAO) A and B from rat brain mitochondrial."
69,15539023 | madecassoside | To evaluate the effects of madecassoside (MC) on the depression behavior of mice and the activities of monoamine oxidase (MAO) in different rat brain regions.
70,"9593705 | phytoene | Analysis of the current data base reveals that PPO has significant sequence similarities to mammalian monoamine oxidases (MAO) A and B, as well as to bacterial and plant phytoene desaturases (PHD)."
71,"26742519 | l-citrulline | Further, Al exposure decreased (p0.001) the levels of neurotransmitters, acetylcholinesterase activity, but increased (p0.001) the levels of L-citrulline as well as activities of nitric oxide and monoamine oxidase in the brain."
72,"11205890 | l-citrulline | Pb greatly increased plasma levels of noradrenaline (NA) and adrenaline (A), but not those of L-DOPA and dopamine; monoaminoxidase activity was augmented by Pb, mostly in the aorta and in the liver; the aorta, liver, heart and kidney showed discrete histopathological alterations in the Pb-exposed rats, in which plasma levels of nitric oxide (NO, determined as L-citrulline) were reduced."
73,"27475863 | piceatannol | Resveratrol and piceatannol inhibited monoamine oxidase (MAO) with respective IC50 of 18.5 and 133.7M, but not semicarbazide-sensitive amine oxidase (SSAO) in hAT."
74,"15120460 | eugenol | A total of seventeen phytochemicals including seven alkaloids (piperine, strychnine, brucine, stachydrine, tetrandrine, frangchinoline and sinomenine), four phenols (paeonol, honokiol, magnolol and eugenol) and six anthraquinones (emodin, rhein, chrysorphanol, aloe-emodin, physcion and 1,8-dihydroxyanthraquinone) was examined for inhibitory activity of monoamine oxidase (MAO) A and B from rat brain mitochondrial."
75,15936201 | eugenol | Results from this study show that eugenol inhibits monoamine oxidase A (MAOA) preferentially with a K(i)=26 microM.
76,15936201 | eugenol | Survey of compounds structurally related to eugenol has identified a few that inhibit MAOs more potently.
77,15936201 | eugenol | Results suggest a potential link between the antidepressant activity of eugenol and its MAOA inhibitory activity.
78,"21190052 | eugenol | Norharman, harman and quercetin dietary presence, pharmacokinetics, and tissue levels were consistent with significant levels reaching neuronal monoamine oxidase from the diet or smoking; 1,2,3,4-tetrahydroisoquinoline, eugenol, 1-piperoylpiperidine, and coumarin were not."
79,"23816060 | hypericin | Hypericin, originally described as a monoamine oxidase inhibitor type A, was thought to be responsible for the antidepressant properties of SJW extracts."
80,"12769695 | squalene | Recent structural data obtained for cyclooxygenases, monoamine oxidase, squalene cyclase, rhodopsine, porins, aquaporins, and ABC transporters are presented and briefly discussed."
81,27517961 | glutaminase | We found increased glutaminase and GABA transaminase (GABA-T) expression and decreased monoamine oxidase B expression in Fmr1 KO astrocytes.
82,"1361009 | glutaminase | Ammonia, lactate and glutamate levels and the activities of glutamine synthetase (GS), glutamate dehydrogenase (GDH), glutaminase (GLN), aspartate transaminase (AST), phosphofructokinase (PFK) and monoamine oxidase (MAO) were compared in the brain tissue of normal and P. yoelii infected mice."
